"","pkg_name","title","pkg_ver","license","roxygen","n_depends","rversion"
"DoE.MIParray","DoE.MIParray","Creation of Arrays by Mixed Integer Programming","0.10","GPL (>= 2)",NA,7,NA
"fauxpas","fauxpas","HTTP Error Helpers","0.1.0","MIT + file LICENSE","5.0.1",8,NA
"GetITRData","GetITRData","Reading Quarterly Financial Reports from Bovespa's ITR System","0.5","GPL-2","6.0.1",14,">= 3.3.0"
"ldhmm","ldhmm","Hidden Markov Model for Return Time-Series Based on Lambda","0.1.0","Artistic-2.0","5.0.1",15,">= 3.3.1"
"idmTPreg","idmTPreg","Regression Model for Progressive Illness Death Data","1.0","GPL-2",NA,6,">= 3.4.0"
"projector","projector","Project Dense Vectors Representation of Texts on a 2D Plan","0.0.1","MIT + file LICENSE","6.0.1",14,">= 3.1"
"worldmet","worldmet","Import Surface Meteorological Data from NOAA Integrated Surface","0.7.5","GPL (>= 2)","5.0.1",7,">= 3.2.0"
"zenplots","zenplots","Zigzag Expanded Navigation Plots","0.0-1","GPL-2 | GPL-3",NA,20,">= 3.0.0"
"fuzzywuzzyR","fuzzywuzzyR","Fuzzy String Matching","1.0.0","GPL-2","5.0.1",6,">= 3.2.3"
"photobiologyLamps","photobiologyLamps","Spectral Data of Light Emission by Lamps","0.4.1","GPL (>= 3)","5.0.1",5,">= 3.2.0"
"rospca","rospca","Robust Sparse PCA using the ROSPCA Algorithm","1.0.0","GPL (>= 2)",NA,11,">= 2.13.0"
"nzpullover","nzpullover","Driving Offences in New Zealand Between 2009 and 2016","0.0.2","CC0","5.0.1.9000",0,">= 3.2.5"
"Rcssplot","Rcssplot","Styling of Graphics using Cascading Style Sheets","0.2.0.0","GPL-2","5.0.1",5,">= 3.1.2"
"rpgm","rpgm","Fast Simulation of Normal Random Variables","0.1.3","GPL-3",NA,0,NA
"stoRy","stoRy","Theme Enrichment Analysis for Stories","0.1.0","GPL-3","6.0.1",2,">= 3.1.0"
"bea.R","bea.R","Bureau of Economic Analysis API","1.0.0","CC0","5.0.1",23,">= 3.2.1"
"CPBayes","CPBayes","Bayesian Meta Analysis for Studying Cross-Phenotype Genetic","0.1.0","GPL-3","5.0.1",5,">= 3.2.0"
"multfisher","multfisher","Optimal Exact Tests for Multiple Binary Endpoints","1.0","GPL-3","6.0.1",1,">= 3.0.0"
"BEACH","BEACH","Biometric Exploratory Analysis Creation House","1.1.1","GPL (>= 2)",NA,11,">= 3.1.0"
"lassopv","lassopv","Nonparametric P-Value Estimation for Predictors in Lasso","0.1.1","GPL-3",NA,2,">= 2.10"
"suncalc","suncalc","Compute Sun Position, Sunlight Phases, Moon Position and Lunar","0.1","GPL-2 | file LICENSE","6.0.1",1,NA
"VeryLargeIntegers","VeryLargeIntegers","Store and Manage Arbitrarily Big Integers","0.1.0","GPL","6.0.1",2,NA
"CircMLE","CircMLE","Maximum Likelihood Analysis of Circular Data","0.1.0","GPL (>= 2)","6.0.1.9000",2,">= 3.2.2"
"sNPLS","sNPLS","NPLS Regression with L1 Penalization","0.1.1","GPL (>= 2)","5.0.1",6,NA
"confSAM","confSAM","Estimates and Bounds for the False Discovery Proportion, by","0.1","GNU General Public License",NA,3,NA
"ratios","ratios","Ratios Between Two Data Sets and Correction for Adhering","1.0.0","GPL-3","6.0.1",2,">= 2.10"
"ggmuller","ggmuller","Create Muller Plots of Evolutionary Dynamics","0.2.0","MIT + file LICENSE","6.0.1",6,">= 3.2.0"
"PakPC2017","PakPC2017","Pakistan Population Census 2017","0.1.0","GPL-2","6.0.1",4,">= 3.1"
"Brundle","Brundle","Normalisation Tools for Inter-Condition Variability of ChIP-Seq","1.0.5","CC BY 4.0","6.0.1",7,NA
"clust.bin.pair","clust.bin.pair","Statistical Methods for Analyzing Clustered Matched Pair Data","0.0.6","MIT + file LICENSE","5.0.1",1,">= 3.2.4"
"ratesci","ratesci","Confidence Intervals for Comparisons of Binomial or Poisson","0.1-0","GPL-3","5.0.1",1,">= 3.2.4"
"EMMIXcskew","EMMIXcskew","Fitting Mixtures of CFUST Distributions","0.9-4","GPL",NA,7,NA
"inferr","inferr","Inferential Statistics","0.1.0","MIT + file LICENSE","5.0.1",11,">= 3.2.4"
"mopa","mopa","Species Distribution MOdeling with Pseudo-Absences","1.0.0","GPL-3","6.0.1",19,">= 3.4.0"
"Rilostat","Rilostat","ILO Open Data via Ilostat Bulk Download Facility or SDMX Web","0.1","BSD_2_clause + file LICENSE","6.0.1",24,">= 3.3.0"
"revdbayes","revdbayes","Ratio-of-Uniforms Sampling for Bayesian Extreme Value Analysis","1.0.0","GPL (>= 2)","5.0.1",10,">= 3.3.1"
"swCRTdesign","swCRTdesign","Stepped Wedge Cluster Randomized Trial (SW CRT) Design","2.1","GPL-2",NA,0,NA
"tatoo","tatoo","Combine and Export Data Frames","1.0.5","MIT + file LICENSE","6.0.1",12,NA
"fivethirtyeight","fivethirtyeight","Data and Code Behind the Stories and Interactives at","0.1.0","MIT + file LICENSE","5.0.1",10,">= 3.2.4"
"tidygraph","tidygraph","A Tidy API for Graph Manipulation","1.0.0","GPL (>= 2)","6.0.1",19,NA
"npcopTest","npcopTest","Non Parametric Test for Detecting Changes in the Copula","1.02","GPL (>= 3)",NA,0,NA
"vote","vote","Election Vote Counting","1.0-0","GPL (>= 2)",NA,2,NA
"adepro","adepro","A Shiny Application for the (Audio-)Visualization of Adverse","0.1.0","GPL-3","6.0.1",10,NA
"OutliersO3","OutliersO3","Draws Overview of Outliers (O3) Plot","0.2.1","GPL (>= 2)","6.0.1",18,">= 3.4.0"
"PTXQC","PTXQC","Quality Report Generation for MaxQuant Results","0.80.13","GPL-2","5.0.1",20,">= 3.0.0"
"valuer","valuer","Pricing of Variable Annuities","1.1.0","GPL-3","5.0.1",12,">= 3.2.5"
"MBC","MBC","Multivariate Bias Correction of Climate Model Outputs","0.1","GPL-2",NA,2,">= 2.10"
"multiApply","multiApply","Apply Functions to Multiple Multidimensional Arguments","0.0.1","LGPL-3","5.0.0",5,">= 3.2.0"
"quantoptr","quantoptr","Algorithms for Quantile- And Mean-Optimal Treatment Regimes","0.1.2","GPL (>= 2)","5.0.1.9000",8,">= 3.2"
"survivalsvm","survivalsvm","Survival Support Vector Analysis","0.0.2","GPL","6.0.1",7,NA
"aVirtualTwins","aVirtualTwins","Adaptation of Virtual Twins Method from Jared Foster","1.0.0","GPL-3 | file LICENSE","5.0.1",8,">= 3.2.0"
"gk","gk","g-and-k and g-and-h Distribution Functions","0.4.0","GPL-2","5.0.1",2,NA
"pcev","pcev","Principal Component of Explained Variance","1.1.1","GPL (>= 2)",NA,3,">= 3.0.0"
"ICSOutlier","ICSOutlier","Outlier Detection Using Invariant Coordinate Selection","0.2-0","GPL (>= 2)",NA,7,">= 3.0.0"
"pipeGS","pipeGS","Permutation p-Value Estimation for Gene Set Tests","0.1","GPL-2","5.0.1",1,NA
"SpaDES.addins","SpaDES.addins","Development Tools for 'SpaDES' and 'SpaDES' Modules","0.1.0","GPL-3","6.0.1",10,">= 3.3.3"
"cifti","cifti","Toolbox for Connectivity Informatics Technology Initiative","0.4.2","GPL-2","6.0.1",6,NA
"gifti","gifti","Reads in Neuroimaging 'GIFTI' Files with Geometry Information","0.7.1","GPL-2","6.0.1",7,NA
"modmarg","modmarg","Calculating Marginal Effects and Levels with Errors","0.5.0","GPL-2","5.0.1",3,">= 2.10.0"
"opticut","opticut","Likelihood Based Optimal Partitioning for Indicator Species","0.1-0","GPL-2",NA,7,">= 3.1.0"
"denoiSeq","denoiSeq","Differential Expression Analysis Using a Bottom-Up Model","0.1.0","GPL-2","6.0.1",6,NA
"nlsr","nlsr","Functions for Nonlinear Least Squares Solutions","2017.2.12","GPL-2",NA,11,">= 3.0"
"OOR","OOR","Optimistic Optimization in R","0.1.1","LGPL","6.0.0",1,NA
"BeSS","BeSS","Best Subset Selection for Sparse Generalized Linear Model and","1.0.0","GPL-3",NA,6,">= 2.0.0"
"ggQC","ggQC","Quality Control Charts for the Grammar of Graphics Plotting","0.0.1","GPL-3 | file LICENSE","6.0.0",8,">= 2.10"
"RBMRB","RBMRB","BMRB Data Access and Visualization","2.0.2","GPL-2","5.0.1",6,">= 3.3.0"
"robustBLME","robustBLME","Robust Bayesian Linear Mixed-Effects Models using ABC","0.1.2","GPL-2","6.0.1",13,">= 3.0.0"
"spatstat.local","spatstat.local","Extension to 'spatstat' for Local Composite Likelihood","3.5-6","GPL (>= 2)",NA,5,">= 3.3.0"
"tibbletime","tibbletime","Time Aware Tibbles","0.0.1","MIT + file LICENSE","6.0.1",10,">= 3.3.0"
"atsd","atsd","Support Querying Axibase Time-Series Database","1.0.8441","Apache License 2.0",NA,5,">= 3.1.2"
"ludic","ludic","Linkage Using Diagnosis Codes","0.1.3","MIT + file LICENSE","5.0.1",6,NA
"phylotate","phylotate","Phylogenies with Annotations","1.0","MIT + file LICENSE",NA,1,">= 3.0.0"
"tRophicPosition","tRophicPosition","Bayesian Trophic Position Calculation with Stable Isotopes","0.7.0","GPL (>= 2)","6.0.1",14,">= 3.4.0"
"waver","waver","Calculate Fetch and Wave Energy","0.2.0","GPL-3","5.0.1",6,">= 3.2.2"
"clustRcompaR","clustRcompaR","Easy Interface for Clustering a Set of Documents and Exploring","0.1.0","GPL-3","5.0.1",7,">= 3.1.3"
"libsoc","libsoc","Read, Create and Write 'PharmML' Standard Output (so) XML Files","0.5","LGPL-3",NA,1,">= 2.14.1"
"zeallot","zeallot","Multiple and Unpacking Variable Assignment","0.0.2","MIT + file LICENSE","5.0.1",4,NA
"ANOVAreplication","ANOVAreplication","Test ANOVA Replications by Means of the Prior Predictive p-Value","1.0.0","GPL (>= 2)",NA,4,NA
"bigtcr","bigtcr","Nonparametric Analysis of Bivariate Gap Time with Competing","1.0","GPL (>= 3)","5.0.1",0,">= 3.3.1"
"kokudosuuchi","kokudosuuchi","R Interface to e-Stat API","0.2.0","MIT + file LICENSE","5.0.1",8,">= 2.10"
"languagelayeR","languagelayeR","Access the 'languagelayer' API","1.0.0","GPL-3","5.0.1",3,NA
"censusr","censusr","Collect Data from the Census API","0.0.2","MIT + file LICENSE","5.0.1",3,NA
"diagis","diagis","Diagnostic Plot and Multivariate Summary Statistics of Weighted","0.1.0","GPL (>= 2)","5.0.1",8,NA
"finch","finch","Parse Darwin Core Files","0.1.0","MIT + file LICENSE","5.0.1",10,NA
"gradDescent","gradDescent","Gradient Descent for Regression Tasks","2.0.1","GPL (>= 2) | file LICENSE","6.0.1",0,NA
"heims","heims","Decode and Validate HEIMS Data from Department of Education,","0.2.4","GPL-3","6.0.1",9,">= 3.3.2"
"datapasta","datapasta","RStudio Addins for Data Copy-Pasta","1.0.0","MIT + file LICENSE","5.0.1",7,">= 3.3.0"
"highlightHTML","highlightHTML","Highlight HTML Text and Tables","0.1.1","MIT + file LICENSE","5.0.1",5,">= 3.0.0"
"TCIApathfinder","TCIApathfinder","Client for the Cancer Imaging Archive REST API","1.0.0","MIT + file LICENSE","6.0.1",3,">= 3.3.2"
"BibPlots","BibPlots","Plot Functions for JIF (Journal Impact Factor) and Paper","0.0.1","EUPL",NA,0,">= 3.1.2"
"Xplortext","Xplortext","Statistical Analysis of Textual Data","1.00","GPL (>= 2.0)","6.0.1",9,">= 3.4.0"
"gLRTH","gLRTH","Likelihood Ratio Test for Genome-Wide Association under Genetic","0.1.0","GPL-3","5.0.1",2,">= 3.3.1"
"OmicsPLS","OmicsPLS","Perform Two-Way Orthogonal Partial Least Squares","1.0.1","GPL-3","6.0.1",6,NA
"pals","pals","Color Palettes, Colormaps, and Tools to Evaluate Them","1.0","GPL-3 + file LICENSE","5.0.1",13,">= 2.10"
"CreditRisk","CreditRisk","Evaluation of Credit Risk with Structural and Reduced Form","0.1.0","MIT + file LICENSE","6.0.1",3,NA
"LinkageMapView","LinkageMapView","Plot Linkage Group Maps with Quantitative Trait Loci","1.0.0","GPL-3","5.0.1",6,NA
"nofrills","nofrills","Low-Cost Anonymous Functions","0.1.0","MIT + file LICENSE","6.0.1",2,">= 3.1.0"
"rMR","rMR","Importing Data from Loligo Systems Software, Calculating","1.0.3","GPL-3","5.0.1",1,">= 2.10"
"tropAlgebra","tropAlgebra","Tropical Algebra Functions","0.1.0","GPL (>= 3)","6.0.1",0,">= 3.3.0"
"dat","dat","Tools for Data Manipulation","0.1.0","MIT + file LICENSE","5.0.1",14,NA
"equSA","equSA","Estimate a Single or Multiple Graphical Models and Construct","1.0.0","GPL-2","6.0.1",5,">= 3.0.2"
"abjutils","abjutils","Useful Tools for Jurimetrical Analysis Used by the Brazilian","0.0.1","MIT + file LICENSE","5.0.1",7,">= 3.3.1"
"lbreg","lbreg","Log-Binomial Regression with Constrained Optimization","1.0","GPL-2",NA,1,">= 3.2.0"
"PSW","PSW","Propensity Score Weighting Methods for Dichotomous Treatments","1.1-1","GPL (>= 2)","6.0.1",4,">= 3.3"
"RNAseqNet","RNAseqNet","Log-Linear Poisson Graphical Model with Hot-Deck Multiple","0.1.0","GPL (>= 3)","5.0.1",5,">= 3.1.0"
"rrpack","rrpack","Reduced-Rank Regression","0.1-5","GPL (>= 3.0)","6.0.1",7,">= 3.3.2"
"canprot","canprot","Chemical Composition of Differential Protein Expression","0.1.0","GPL-3",NA,5,">= 3.1.0"
"dtree","dtree","Decision Trees","0.2.3","GPL (>= 2)","6.0.1",14,NA
"SMMA","SMMA","Soft Maximin Estimation for Large Scale Array-Tensor Models","1.0.1","GPL-3","5.0.1",3,NA
"mau","mau","Decision Models with Multi Attribute Utility Theory","0.1.0","LGPL-3","5.0.1",6,">= 3.0"
"optimus","optimus","Model Based Diagnostics for Multivariate Cluster Analysis","0.1.0","GPL-3","6.0.1",7,">= 3.1.0"
"ROI.plugin.lpsolve","ROI.plugin.lpsolve","'lp_solve' Plugin for the 'R' Optimization Interface","0.0-1","GPL-3",NA,5,NA
"splashr","splashr","Tools to Work with the 'Splash' 'JavaScript' Rendering and","0.4.0","AGPL","6.0.1",23,">= 3.2.0"
"easySdcTable","easySdcTable","Easy Interface to the Statistical Disclosure Control Package","0.1","Apache License 2.0 | file LICENSE","5.0.1",2,">= 3.0.0"
"COMBAT","COMBAT","A Combined Association Test for Genes using Summary Statistics","0.0.2","GPL-2",NA,3,">= 3.2.0"
"cordillera","cordillera","Calculation of the OPTICS Cordillera","0.7-0","GPL-2 | GPL-3","6.0.1",5,">= 3.1.2"
"photobiologyLEDs","photobiologyLEDs","Spectral Data for Light-Emitting-Diodes","0.4.2","GPL (>= 3)","5.0.1",5,">= 3.2.0"
"Emcdf","Emcdf","Computation and Visualization of Empirical Joint Distribution","0.1.0","GPL-3","5.0.1",4,">= 3.2.5"
"preText","preText","Diagnostics to Assess the Effects of Text Preprocessing","0.4.4","GPL-3","5.0.1",14,">= 3.3.0"
"PRIMME","PRIMME","Eigenvalues and Singular Values and Vectors from Large Matrices","2.1-0","GPL-3","6.0.1",4,NA
"rSQM","rSQM","Statistical Downscaling Toolkit for Climate Change Scenario","1.2.42","GPL (>= 2)","6.0.1",14,">= 3.3.3"
"tsdf","tsdf","Two-/Three-Stage Designs for Phase 1&2 Clinical Trials","1.1-2","GPL-2","6.0.1",3,NA
"brant","brant","Test for Parallel Regression Assumption","0.1-0","GPL (>= 2)",NA,1,">= 3.1.0"
"IATScore","IATScore","Scoring Algorithm for the Implicit Association Test (IAT)","0.1.0","MIT + file LICENSE","6.0.1",0,NA
"influxdbr","influxdbr","R Interface to InfluxDB","0.12.0","GPL-3","6.0.1",10,NA
"MultiRNG","MultiRNG","Multivariate Pseudo-Random Number Generation","1.0","GPL-2 | GPL-3",NA,0,NA
"RandPro","RandPro","Random Projection","0.1.0","GPL (>= 2)","5.0.1",1,NA
"rFSA","rFSA","Feasible Solution Algorithm for Finding Best Subsets and","0.1.0","GPL-2","5.0.1",2,">= 2.15.0"
"UnivRNG","UnivRNG","Univariate Pseudo-Random Number Generation","1.0","GPL-2 | GPL-3","5.0.1",0,NA
"elevatr","elevatr","Access Elevation Data from Various APIs","0.1.0","CC0","5.0.1",12,">= 3.0.0"
"Rbgs","Rbgs","Video Reading and Background Subtraction in Videos","0.0.1","GPL-2","6.0.1",7,">= 3.2.4"
"RGBM","RGBM","LS-TreeBoost and LAD-TreeBoost for Gene Regulatory Network","1.0-4","GPL (>= 3)",NA,3,NA
"univOutl","univOutl","Detection of Univariate Outliers","0.1-3","GPL (>= 2)",NA,2,NA
"constants","constants","Reference on Constants, Units and Uncertainty","0.0.1","MIT + file LICENSE","6.0.1",3,">= 3.0.0"
"csv","csv","Read and Write CSV Files with Selected Conventions","0.3","GPL-3","6.0.1",0,NA
"dynsbm","dynsbm","Dynamic Stochastic Block Models","0.3","GPL-3",NA,8,NA
"sgee","sgee","Stagewise Generalized Estimating Equations","0.2-0","GPL (>= 3)","5.0.1",3,">= 3.0.0"
"grove","grove","Wavelet Functional ANOVA Through Markov Groves","1.0","GPL (>= 3)",NA,5,NA
"fmbasics","fmbasics","Financial Market Building Blocks","0.1.0","GPL-2","6.0.1",7,NA
"MatManlyMix","MatManlyMix","Matrix Clustering with Gaussian and Manly Mixture Models","0.1.2","GPL (>= 2)",NA,0,">= 3.0.0"
"fastrtext","fastrtext","'fastText' Wrapper for Text Classification and Word","0.2.0","MIT + file LICENSE","6.0.1",6,NA
"fmdates","fmdates","Financial Market Date Calculations","0.1.0","GPL-2","5.0.1.9000",9,NA
"ipft","ipft","Indoor Positioning Fingerprinting Toolset","0.1.03","GPL (>= 2)","5.0.1",8,">= 2.10"
"SparseDC","SparseDC","Implementation of SparseDC Algorithm","0.1.5","GPL-3","6.0.1",3,">= 3.1.0"
"tidystringdist","tidystringdist","String Distance Calculation with Tidy Data Principles","0.1.0","MIT + file LICENSE","6.0.1.9000",6,NA
"Biolinv","Biolinv","Modelling and Forecasting Biological Invasions","0.1-1","GPL-3","5.0.1",7,">= 3.2.4"
"miRNAss","miRNAss","Genome-Wide Discovery of Pre-miRNAs with few Labeled Examples","1.0","Apache License 2.0","6.0.1",6,NA
"naivebayes","naivebayes","High Performance Implementation of the Naive Bayes Algorithm","0.9.0","GPL-2",NA,0,NA
"sofa","sofa","Connector to 'CouchDB'","0.2.0","MIT + file LICENSE","5.0.1",9,NA
"bhm","bhm","Biomarker Threshold Models","1.1","GPL (>= 2)",NA,3,NA
"rxylib","rxylib","Import XY-Data into R","0.1.0","GPL-3 | LGPL-2.1","6.0.1",7,">= 3.3.0"
"widgetframe","widgetframe","'Htmlwidgets' in Responsive 'iframes'","0.1.0","MIT + file LICENSE","6.0.1",8,">= 3.1.0"
"msde","msde","Bayesian Inference for Multivariate Stochastic Differential","1.0.2","GPL-3","6.0.1",10,">= 3.0.0"
"mudfold","mudfold","A Nonparametric Model for Unfolding Scale Analysis","1.0","GPL (>= 2)",NA,6,">= 3.3.3"
"AmesHousing","AmesHousing","The Ames Iowa Housing Data","0.0.2","GPL-2","6.0.1",2,">= 2.10"
"PKPDmisc","PKPDmisc","Pharmacokinetic and Pharmacodynamic Data Management Functions","2.0.0","MIT + file LICENSE","6.0.1",18,">= 3.2.2"
"stringformattr","stringformattr","Dynamic String Formatting","0.1.0","MIT + file LICENSE","5.0.1",1,NA
"SyncRNG","SyncRNG","A Synchronized Tausworthe RNG for R and Python","1.2.1","GPL-2","5.0.1",2,">= 3.0.0"
"zonator","zonator","Utilities for Zonation Spatial Conservation Prioritization","0.5.7","FreeBSD","6.0.1",11,">= 2.15.2"
"cleanEHR","cleanEHR","The Critical Care Clinical Data Processing Tools","0.1","GPL-3","5.0.1",12,">= 3.1.0"
"gofastr","gofastr","Fast DocumentTermMatrix and TermDocumentMatrix Creation","0.1.1","GPL-2","5.0.1",7,">= 3.2.2"
"BisRNA","BisRNA","Analysis of RNA Cytosine-5 Methylation","0.2.1","GPL (>= 2)",NA,7,">= 3.3.2"
"clustEff","clustEff","Clusters of Effect Curves in Quantile Regression Models","0.1.0","GPL-2","6.0.1",3,NA
"GMAC","GMAC","Genomic Mediation Analysis with Adaptive Confounding Adjustment","1.0","GPL",NA,2,NA
"elo","elo","Elo Ratings","0.1.2","GPL (>= 2)","6.0.1",5,">= 3.3.1"
"libcoin","libcoin","Linear Test Statistics for Permutation Inference","0.9-0","GPL-2",NA,3,">= 3.3.0"
"corpus","corpus","Text Corpus Analysis","0.2-0","Apache License (== 2.0) | file LICENSE",NA,1,NA
"inum","inum","Interval and Enum-Type Representation of Vectors","0.9-0","GPL-2",NA,1,">= 3.3.0"
"refset","refset","Subsets with Reference Semantics","0.1.0","GPL-2",NA,3,NA
"parsemsf","parsemsf","Parse Thermo MSF Files and Estimate Protein Abundances","0.1.0","GPL-2","5.0.1",10,">= 3.2.4"
"Inventorymodel","Inventorymodel","Inventory Models","1.0.3","GPL-2",NA,2,">= 2.15.0"
"plotrr","plotrr","Making Visual Exploratory Data Analysis Easier","0.2.0","MIT + file LICENSE","5.0.1.9000",3,NA
"mazeGen","mazeGen","Elithorn Maze Generator","0.1.0","GPL-3","5.0.1",2,NA
"mdw","mdw","Maximum Diversity Weighting","2017.8-27","GPL-2","6.0.1.9000",2,">= 3.3.0"
"networkGen","networkGen","Network Maze Generator","0.1.0","GPL-3","6.0.1",3,NA
"striprtf","striprtf","Extract Text from RTF File","0.2.2","MIT + file LICENSE","5.0.1",5,">= 2.10"
"xesreadR","xesreadR","Read and Write XES Files","0.1.0","MIT + file LICENSE","6.0.1",8,">= 3.0.0"
"EAinference","EAinference","Simulation Based Inference of Lasso Estimator","0.2.0","GPL (>= 2)","6.0.1",14,">= 3.2.3"
"harrietr","harrietr","Wrangle Phylogenetic Distance Matrices and Other Utilities","0.2.2","GPL-3 | file LICENSE","6.0.1",7,">= 3.3.0"
"NestedCategBayesImpute","NestedCategBayesImpute","Modeling and Generating Synthetic Versions of Nested Categorical","1.0.0","GPL (>= 3)",NA,5,NA
"adapr","adapr","Implementation of an Accountable Data Analysis Process","1.0.1","LGPL-2","5.0.1",14,">= 3.1"
"goftte","goftte","Goodness-of-Fit for Time-to-Event Data","1.0.1","GPL",NA,4,">= 3.0.3"
"passport","passport","Travel Smoothly Between Country Name and Code Formats","0.1.1","GPL-3 | file LICENSE","6.0.1",12,">= 3.1.0"
"SASmarkdown","SASmarkdown","'SAS' Markdown","0.3.3","MIT + file LICENSE","6.0.1",1,NA
"MUS","MUS","Monetary Unit Sampling and Estimation Methods, Widely Used in","0.1.4","GPL (>= 2)",NA,1,">= 3.3.2"
"Dforest","Dforest","Decision Forest","0.4.0","GPL-2","5.0.1",4,">= 3.0"
"phase1RMD","phase1RMD","Repeated Measurement Design for Phase I Clinical Trial","1.0.5","GPL (>= 2)",NA,5,">= 3.0.0"
"simEd","simEd","Simulation Education","1.0.0","GPL (>= 2)",NA,6,NA
"cctools","cctools","Tools for the Continuous Convolution Trick in Nonparametric","0.1.0","GPL-3","6.0.1",6,NA
"unitizer","unitizer","Interactive R Unit Tests","1.4.0","GPL (>= 2)","6.0.1",10,NA
"CorporaCoCo","CorporaCoCo","Corpora Co-Occurrence Comparison","1.0-1","GPL (>= 3)",NA,7,">= 3.1.0"
"IDCard","IDCard","Update Chinese ID Card Number to Eighteen Digits","0.1.0","GPL-3",NA,0,NA
"MHTdiscrete","MHTdiscrete","Multiple Hypotheses Testing for Discrete Data","0.1.0","GPL (>= 2)","5.0.1",0,NA
"powdist","powdist","Power and Reversal Power Distributions","0.1.2","GPL-3","6.0.1",2,">= 3.1.0"
"futility","futility","Interim Analysis of Operational Futility in Randomized Trials","0.1","GPL-2","6.0.1",5,NA
"KMgene","KMgene","Gene-Based Association Analysis for Complex Traits","1.0","GPL (>= 2)","6.0.0",6,NA
"LCF","LCF","Linear Combination Fitting","1.6-6","GPL-3","5.0.1",1,">= 3.2.1"
"ManifoldOptim","ManifoldOptim","An R Interface to the ROPTLIB Library for Riemannian Manifold","0.1.0","GPL (>= 2)","5.0.1",4,NA
"epicontacts","epicontacts","Handling, Visualisation and Analysis of Epidemiological Contacts","1.0.0","GPL (>= 2)","6.0.1",14,NA
"ICRanks","ICRanks","Simultaneous Confidence Intervals for Ranks","1.0","GPL (>= 2)","6.0.1.9000",3,NA
"RcppHMM","RcppHMM","Rcpp Hidden Markov Model","1.0.1","GPL (>= 2)",NA,2,NA
"RcppTN","RcppTN","Rcpp-Based Truncated Normal Distribution RNG and Family","0.2-1","GPL (>= 2)","6.0.1",8,NA
"AWR.Athena","AWR.Athena","'AWS' Athena DBI Wrapper","1.1.0","AGPL-3","6.0.1",3,NA
"wicket","wicket","Utilities to Handle WKT Spatial Data","0.2.0","MIT + file LICENSE","5.0.1",6,NA
"easyAHP","easyAHP","Analytic Hierarchy Process (AHP)","0.1.0","GPL-3",NA,0,NA
"xslt","xslt","XSLT 1.0 Transformations","1.0","GPL (>= 2)","5.0.1.9000",4,NA
"gamreg","gamreg","Robust and Sparse Regression via Gamma-Divergence","0.1","GPL (>= 2)","5.0.1",7,NA
"revgeo","revgeo","Reverse Geocoding with the Photon Geocoder for OpenStreetMap and","0.11","GPL (>= 3.0)","6.0.1.9000",2,">= 3.3.2"
"spiderbar","spiderbar","Parse and Test Robots Exclusion Protocol Files and Rules","0.2.0","MIT + file LICENSE","6.0.1",5,">= 3.2.0"
"sppmix","sppmix","Modeling Spatial Poisson and Related Point Processes","1.0.0.0","CC BY-NC-SA 4.0","5.0.1",18,">= 3.2.1"
"modest","modest","Model-Based Dose Escalation Shiny Tools","0.1","GPL-2",NA,3,NA
"ICCbin","ICCbin","Facilitates Clustered Binary Data Generation, and Estimation of","1.0","GPL (>= 2)","5.0.1",1,NA
"dparser","dparser","Port of Dparser Package","0.1.3","BSD_3_clause + file LICENSE","6.0.1",7,">= 3.2.3"
"StakeholderAnalysis","StakeholderAnalysis","Measuring Stakeholder Influence","1.0","GPL (>= 2)",NA,0,">= 3.2.3"
"qboxplot","qboxplot","Quantile-Based Boxplot","0.1","GPL-2",NA,2,NA
"rsample","rsample","General Resampling Infrastructure","0.0.1","GPL-2","6.0.1",11,">= 3.3.3"
"ThankYouStars","ThankYouStars","Give your Dependencies Stars on GitHub!","0.1.0","MIT + file LICENSE","6.0.1",3,NA
"BatchMap","BatchMap","Software for the Creation of High Density Linkage Maps in","1.0.0.0","GPL-3","6.0.1",8,">= 3.2.0"
"anocva","anocva","A Non-Parametric Statistical Test to Compare Clustering","0.1.0","GPL (>= 3)","5.0.1",3,">= 2.10.0"
"PdPDB","PdPDB","Pattern Discovery in PDB Structures of Metalloproteins","1.0","MIT + file LICENSE","5.0.1",1,NA
"rGoodData","rGoodData","GoodData API Client Package","0.1.0","GPL","6.0.1",6,NA
"rLDCP","rLDCP","Text Generation from Data","1.0.0","GPL (>= 2) | file LICENSE","5.0.1",3,NA
"rODE","rODE","Ordinary Differential Equation (ODE) Solvers Written in R Using","0.99.4","GPL-2","6.0.1",8,">= 3.3.0"
"geojson","geojson","Classes for 'GeoJSON'","0.1.0","MIT + file LICENSE","5.0.1",12,NA
"epxToR","epxToR","Import 'Epidata' XML Files '.epx'","0.1-0","GPL-3",NA,2,NA
"Diderot","Diderot","Bibliographic Network Analysis","0.1","GPL (>= 2)",NA,11,"> 3.0.1"
"RcppQuantuccia","RcppQuantuccia","R Bindings to the 'Quantuccia' Header-Only Essentials of","0.0.1","GPL (>= 2)","6.0.1",3,NA
"ArCo","ArCo","Artificial Counterfactual Package","0.1-1","MIT + file LICENSE","6.0.1",3,NA
"lplyr","lplyr","'dplyr' Verbs for Lists and Other Verbs for Data Frames","0.1.6","MIT + file LICENSE","5.0.1",8,">= 3.1.3"
"Pstat","Pstat","Assessing Pst Statistics","1.0","GPL-2",NA,0,NA
"RJSplot","RJSplot","Interactive Graphs with R","2.1","CC BY-NC-SA 4.0",NA,1,">= 3.0.0"
"slowraker","slowraker","A Slow Version of the Rapid Automatic Keyword Extraction (RAKE)","0.1.0","MIT + file LICENSE","6.0.1.9000",7,">= 3.1"
"infraFDTD.assist","infraFDTD.assist","IO Help for infraFDTD Model","0.5","GPL (>= 2)",NA,2,NA
"MBHdesign","MBHdesign","Spatial Designs for Ecological and Environmental Surveys","1.0.60","GPL (>= 2)",NA,10,NA
"phylocanvas","phylocanvas","Interactive Phylogenetic Trees Using the 'Phylocanvas'","0.1.0","MIT + file LICENSE","5.0.1",7,">= 3.3.1"
"rsurfer","rsurfer","Manipulating 'Freesurfer' Generated Data","0.1","MIT + file LICENSE","6.0.1",2,">= 3.3.3"
"coppeCosenzaR","coppeCosenzaR","COPPE-Cosenza Fuzzy Hierarchy Model","0.1.0","GPL-2 | file LICENSE","6.0.1",2,">= 3.2.2"
"vfcp","vfcp","Computation of v Values for U and Copula C(U, v)","0.1.0","GPL (>= 3)","6.0.1",3,NA
"countyfloods","countyfloods","Quantify United States County-Level Flood Measurements","0.0.1","GPL (>= 2)","6.0.1",14,">= 2.10"
"FinAna","FinAna","Financial Analysis and Regression Diagnostic Analysis","0.1.0","GPL (>= 2)",NA,0,NA
"kaphom","kaphom","Test the Homogeneity of Kappa Statistics","0.1.0","GPL-3","6.0.1",1,NA
"meanr","meanr","Basic Sentiment Analysis Scorer","0.1-0","BSD 2-clause License + file LICENSE","6.0.1",0,">= 3.0.0"
"routr","routr","A Simple Router for HTTP and WebSocket Requests","0.2.0","MIT + file LICENSE","6.0.1",12,NA
