"","pkg_name","title","pkg_ver","license","roxygen","n_depends","rversion"
"WordR","WordR","Rendering Word Documents with R Inline Code","0.2.1","GPL-3","6.0.1",7,NA
"ggiraphExtra","ggiraphExtra","Make Interactive 'ggplot2'. Extension to 'ggplot2' and 'ggiraph'","0.1.0","GPL-3","5.0.1",17,">= 2.10"
"MSbox","MSbox","Mass Spectrometry Tools","0.1.0","GPL-2","6.0.1",0,NA
"survutils","survutils","Utility Functions for Survival Analysis","1.0.0","MIT + file LICENSE","5.0.1",10,">= 3.1.2"
"BAMBI","BAMBI","Bivariate Angular Mixture Models","1.0.0","GPL-3","5.0.1",8,">= 3.2.0"
"ggpval","ggpval","Annotate Statistical Tests for 'ggplot2'","0.1.0","GPL-3","6.0.1",4,NA
"wdman","wdman","'Webdriver'/'Selenium' Binary Manager","0.2.0","MIT + file LICENSE","5.0.1",9,">= 3.2"
"BALCONY","BALCONY","Better ALignment CONsensus analYsis","0.1.5","GPL","6.0.1",5,NA
"ggstance","ggstance","Horizontal 'ggplot2' Components","0.3","GPL-3","5.0.1",7,">= 3.2.2"
"lumberjack","lumberjack","Track Changes in Data the Tidy Way","0.1.0","GPL-3","6.0.1",5,NA
"Seurat","Seurat","Tools for Single Cell Genomics","2.0.1","GPL-3 | file LICENSE","6.0.1",44,">= 3.2.0"
"spind","spind","Spatial Methods and Indices","2.0.0","GPL-3","6.0.1",11,">= 3.0.0"
"spm","spm","Spatial Predictive Modeling","1.0.0","GPL (>= 2)","6.0.1",8,">= 2.10"
"vagalumeR","vagalumeR","Access to the 'Vagalume' API","0.1.0","GPL-2","6.0.1",8,">= 3.2.3"
"blastula","blastula","Easily Send HTML Email Messages","0.1","MIT + file LICENSE","6.0.1",12,">= 3.4.0"
"ncar","ncar","Noncompartmental Analysis of Pharmacokinetic Data for CDISC","0.3.1","GPL-3 | file LICENSE","5.0.1",5,">= 2.10"
"NonCompart","NonCompart","Noncompartmental Analysis of Pharmacokinetics","0.2.3","GPL-3",NA,0,">= 3.0.0"
"rwalkr","rwalkr","API to Melbourne Pedestrian Data","0.1.0","MIT + file LICENSE","6.0.1",2,">= 3.1.3"
"binman","binman","A Binary Download Manager","0.0.7","MIT + file LICENSE","5.0.1",12,">= 3.2"
"CNLTreg","CNLTreg","Complex-Valued Wavelet Lifting for Signal Denoising","0.1","GPL-2",NA,4,NA
"CNLTtsa","CNLTtsa","Complex-Valued Wavelet Lifting for Univariate and Bivariate Time","0.1","GPL-2",NA,4,">= 2.10"
"future.batchtools","future.batchtools","A Future API for Parallel and Distributed Processing using","0.5.0","LGPL (>= 2.1)","6.0.1",5,">= 3.2.0"
"qqplotr","qqplotr","Quantile-Quantile Plot Extensions for 'ggplot2'","0.0.1","GPL-3 | file LICENSE","6.0.1",4,NA
"rmpw","rmpw","Causal Mediation Analysis Using Weighting Approach","0.0.1","GPL-2","6.0.1",0,NA
"SmoothWin","SmoothWin","Soft Windowing on Linear Regression","1.0.0","LGPL (>= 2)",NA,1,">= 2.0"
"CATkit","CATkit","Analyze Periodicity","3.0.0.1","GPL-2",NA,10,NA
"CodeDepends","CodeDepends","Analysis of R Code for Reproducible Research and Code","0.5-3","GPL",NA,11,NA
"dgo","dgo","Dynamic Estimation of Group-Level Opinion","0.2.9","GPL-3","6.0.1",14,">= 3.2.2"
"easyDes","easyDes","An Easy Way to Descriptive Analysis","1.0","GPL-3",NA,4,">= 3.3.2"
"glue","glue","Interpreted String Literals","1.0.0","MIT + file LICENSE","6.0.1",3,">= 3.0.0"
"pinp","pinp","'pinp' is not 'PNAS'","0.0.1","GPL-3","6.0.1",2,NA
"rmda","rmda","Risk Model Decision Analysis","1.4","GPL-2","6.0.1",4,NA
"RTransProb","RTransProb","Analyze and Forecast Credit Migrations","0.1.0","GPL-2","6.0.1",7,">= 2.2.0"
"scatterpie","scatterpie","Scatterpie Plot","0.0.5","Artistic-2.0","5.0.1",7,">= 3.3.0"
"BayesianTools","BayesianTools","General-Purpose MCMC and SMC Samplers and Tools for Bayesian","0.1.0","CC BY-SA 4.0","6.0.0",23,">= 3.1.2"
"beyondWhittle","beyondWhittle","Bayesian Spectral Inference for Stationary Time Series","0.17","GPL (>= 3)","5.0.1",3,NA
"DendroSync","DendroSync","A Set of Tools for Calculating Spatial Synchrony Between","0.1.0","GPL-2","6.0.1",5,">= 3.1.2"
"GCalignR","GCalignR","Simple Peak Alignment for Gas-Chromatography Data","0.1.0","GPL (>= 2)","5.0.1",12,">= 3.2.5"
"keyring","keyring","Access the System Credential Store from R","1.0.0","MIT + file LICENSE","6.0.1",9,NA
"ordinalForest","ordinalForest","Prediction and Class Width Inference with","1.0","GPL-2","5.0.1",3,NA
"spacyr","spacyr","R Wrapper to the spaCy NLP Library","0.9.0","GPL-3","6.0.1",7,">= 3.3.0"
"WRTDStidal","WRTDStidal","Weighted Regression for Water Quality Evaluation in Tidal Waters","1.0.1","CC0","5.0.1",15,">= 3.1.2"
"benchr","benchr","High Precise Measurement of R Expressions Execution Time","0.1.0","GPL (>= 2)","5.0.1",6,NA
"GreedyExperimentalDesign","GreedyExperimentalDesign","Greedy Experimental Design Construction","1.0","GPL-3","5.0.1",4,">= 3.2.0"
"MODIStsp","MODIStsp","A Tool for Automating Download and Preprocessing of MODIS Land","1.3.2","GPL-3","6.0.1",22,">= 3.1.3"
"Rlinsolve","Rlinsolve","Iterative Solvers for (Sparse) Linear System of Equations","0.1.0","GPL (>= 3)","6.0.1",9,NA
"SpaDES.tools","SpaDES.tools","Additional Tools for Developing Spatially Explicit Discrete","0.1.0","GPL-3","6.0.1",33,">= 3.3.2"
"FRK","FRK","Fixed Rank Kriging","0.1.1","GPL (>= 2.1)","6.0.0",26,">= 3.1"
"htree","htree","Historical Tree Ensembles for Longitudinal Data","0.1.1","GPL (>= 2)",NA,0,">= 2.9.0"
"incadata","incadata","Recognize and Handle Data in Formats Used by Swedish Cancer","0.5.3","GPL-2","6.0.1",8,">= 2.10"
"Rlda","Rlda","Bayesian LDA for Mixed-Membership Clustering Analysis","0.1.0","GPL-2","6.0.1",8,">= 2.10"
"gemlog","gemlog","File Conversion for 'Gem Infrasound Logger'","0.20","GPL",NA,1,NA
"MAGNAMWAR","MAGNAMWAR","A Pipeline for Meta-Genome Wide Association","1.0.0","MIT + file LICENSE","6.0.1",15,">= 3.0"
"qGaussian","qGaussian","The q-Gaussian Distribution","0.1.4","GPL","5.0.1",3,">= 3.2.0"
"spass","spass","Study Planning and Adaptation of Sample Size","1.0","GPL",NA,8,NA
"desctable","desctable","Produce Descriptive and Comparative Tables Easily","0.1.0","GPL-3","6.0.1",8,">= 3.2.3"
"polyPK","polyPK","The Pharmacokinetics (PK) of Multi-Component Drugs Using a","1.0.0","GPL-2",NA,15,NA
"bayesDP","bayesDP","Tools for the Bayesian Discount Prior Function","1.0.0","GPL-3","6.0.1",7,NA
"cetcolor","cetcolor","CET Perceptually Uniform Colour Maps","0.1.0","CC BY-SA 4.0","6.0.1",2,">= 3.3.2"
"crul","crul","HTTP Client","0.1.0","MIT + file LICENSE","5.0.1",7,NA
"MetaSubtract","MetaSubtract","Subtracting Summary Statistics of One or more Cohorts from","1.0","GPL (>= 3)",NA,0,NA
"pdfsearch","pdfsearch","Search Tools for PDF Files","0.1.1","MIT + file LICENSE","5.0.1",4,">= 3.3.0"
"qicharts2","qicharts2","Quality Improvement Charts","0.1.1","GPL-3","6.0.1",8,">= 3.0.0"
"rhoR","rhoR","Rho for Inter Rater Reliability","1.0.0","GPL-3 | file LICENSE","5.0.1",1,">= 3.0.0"
"spelling","spelling","Tools for Spell Checking in R","1.0","MIT + file LICENSE","6.0.1",4,NA
"phylopath","phylopath","Perform Phylogenetic Path Analysis","0.2.0","GPL-3","5.0.1",13,">= 2.10"
"ggforce","ggforce","Accelerating 'ggplot2'","0.1.0","GPL (>= 2)","5.0.1",14,">= 2.10"
"ggraph","ggraph","An Implementation of Grammar of Graphics for Graphs and Networks","1.0.0","GPL-3","6.0.1",19,">= 2.10"
"AcousticNDLCodeR","AcousticNDLCodeR","Coding Sound Files for Use with NDL","1.0.0","GPL (>= 2)","6.0.1",4,">= 3.0.0"
"CytobankAPI","CytobankAPI","Cytobank API Wrapper for R","1.0.0","Artistic-2.0","5.0.1",7,NA
"docxtools","docxtools","Tools for R Markdown to Docx Documents","0.1.0","MIT + file LICENSE","5.0.1",6,NA
"ggfittext","ggfittext","Fit Text Inside a Box in 'ggplot2'","0.4.3","GPL-2","6.0.1",6,">= 3.3.2"
"bmixture","bmixture","Bayesian Estimation for Finite Mixture of Distributions","0.1","GPL (>= 3)",NA,0,">= 3.0.0"
"permDep","permDep","Permutation Tests for General Dependent Truncation","1.0-0","GPL (>= 3)",NA,4,NA
"satscanMapper","satscanMapper","'SaTScan' (TM) Results Mapper","1.0.0","GPL (>= 2)",NA,10,">= 3.3.0"
"GADMTools","GADMTools","Easy Use of 'GADM' Shapefiles","2.0-1","GPL-3",NA,14,NA
"kernelboot","kernelboot","Smoothed Bootstrap and Random Generation from Kernel Densities","0.1.0","GPL-2","6.0.1",7,">= 3.1.0"
"visdat","visdat","Preliminary Data Visualisation","0.1.0","MIT + file LICENSE","6.0.1.9000",11,">= 3.2.2"
"DatabionicSwarm","DatabionicSwarm","Swarm Intelligence for Self-Organized Clustering","0.9.7","GPL-3",NA,16,">= 3.0"
"GeneralizedUmatrix","GeneralizedUmatrix","Credible Visualization for Two-Dimensional Projections of Data","0.9.4","GPL-3",NA,8,">= 3.0"
"ggedit","ggedit","Interactive 'ggplot2' Layer and Theme Aesthetic Editor","0.2.0","GPL-2 | GPL-3","6.0.1",16,">= 2.3.0"
"glmmTMB","glmmTMB","Generalized Linear Mixed Models using Template Model Builder","0.1.1","AGPL-3","6.0.1",18,NA
"processmapR","processmapR","Construct Process Maps Using Event Data","0.1.0","MIT + file LICENSE","6.0.1",8,NA
"spup","spup","Uncertainty Propagation Analysis","0.1-0","GPL (>= 3)","5.0.1",14,">= 3.3.3"
"disco","disco","Discordance and Concordance of Transcriptomic Responses","0.5","GPL (>= 2.0)","6.0.1.9000",4,">= 2.10"
"drtmle","drtmle","Doubly-Robust Nonparametric Estimation and Inference","1.0.0","MIT + file LICENSE","6.0.1",11,">= 3.2.0"
"neatmaps","neatmaps","Heatmaps for Multiple Network Data","1.0.2","MIT + file LICENSE","6.0.1.9000",9,">= 3.4.0"
"simule","simule","A Constrained L1 Minimization Approach for Estimating Multiple","1.0.0","GPL-2","6.0.1",3,">= 3.0.0"
"bupaR","bupaR","Business Process Analytics in R","0.1.0","MIT + file LICENSE","5.0.1",5,NA
"GenomicMating","GenomicMating","Efficient Breeding by Genomic Mating","1.0","GPL-2",NA,5,NA
"ImputeRobust","ImputeRobust","Robust Multiple Imputation with Generalized Additive Models for","1.1-0","GPL-3","5.0.1",6,">= 3.2.0"
"biolink","biolink","Create Hyperlinks to Biological Databases and Resources","0.1.2","MIT + file LICENSE","6.0.1",8,NA
"crplyr","crplyr","A 'dplyr' Interface for Crunch","0.1.0","LGPL (>= 3)","6.0.0",7,">= 3.0.0"
"expint","expint","Exponential Integral and Incomplete Gamma Function","0.1-0","GPL (>= 2)",NA,0,">= 3.3.0"
"learnr","learnr","Interactive Tutorials for R","0.8","Apache License 2.0 | file LICENSE","6.0.1",14,NA
"mfe","mfe","Meta-Feature Extractor","0.1.0","GPL | file LICENSE","5.0.1",11,">= 3.3.1"
"multicmp","multicmp","Flexible Modeling of Multivariate Count Data via the","1.0","GPL-3","6.0.0",2,NA
"pool","pool","Object Pooling","0.1.1","GPL-3","6.0.1",9,">= 3.0.0"
"SCORPIUS","SCORPIUS","Inferring Developmental Chronologies from Single-Cell RNA","1.0","GPL-3","6.0.1",24,">= 3.0.0"
"support.BWS2","support.BWS2","Basic Functions for Supporting an Implementation of Case 2","0.1-0","GPL (>= 2)",NA,2,NA
"taxlist","taxlist","Handling Taxonomic Lists","0.1.0","GPL (>= 2)",NA,10,">= 3.0.0"
"vegtable","vegtable","Handling Vegetation Data Sets","0.1.0","GPL (>= 2)",NA,9,">= 3.0.0"
"cld3","cld3","Google's Compact Language Detector 3","1.0","Apache License 2.0","6.0.1",4,NA
"dynOmics","dynOmics","Fast Fourier Transform to Identify Associations Between Time","1.0","GPL (>= 2) | file LICENSE","5.0.1",5,">= 3.0.0"
"prioritizr","prioritizr","Systematic Conservation Prioritization in R","0.1.2","MIT + file LICENSE","5.0.1",18,">= 3.1.2"
"raptr","raptr","Representative and Adequate Prioritization Toolkit in R","0.0.1","GPL-3","5.0.1",37,">= 3.1.0"
"ropercenter","ropercenter","Reproducible Data Retrieval from the Roper Center Data Archive","0.1.0","MIT + file LICENSE","6.0.1",9,NA
"SimMultiCorrData","SimMultiCorrData","Simulation of Correlated Data with Multiple Variable Types","0.1.0","GPL-2","6.0.1",15,">= 3.3.1"
"colordistance","colordistance","Distance Metrics for Image Color Similarity","0.8.0","GPL-3","6.0.1",16,">= 3.3.2"
"CytobankAPIstats","CytobankAPIstats","Computes Signaling and Population Stats for Cytometry Data on","1.0","Artistic-2.0","6.0.1",6,NA
"dng","dng","Distributions and Gradients","0.1.0","GPL (>= 2)",NA,3,">= 3.0.0"
"GBJ","GBJ","Generalized Berk-Jones Statistic for Set-Based Inference","0.4.0","GPL-3","5.0.1",9,">= 2.10"
"ClusterBootstrap","ClusterBootstrap","Analyze Clustered Data with Generalized Linear Models using the","0.9.3","GPL-3","6.0.1",4,">= 3.0"
"fetchR","fetchR","Calculate Wind Fetch in R","2.0-0","GPL-2","5.0.1",9,NA
"jpmesh","jpmesh","Utilities for Japanese Mesh Code","0.3.0","MIT + file LICENSE","5.0.1",15,">= 2.10"
"padr","padr","Quickly Get Datetime Data Ready for Analysis","0.1.0","MIT + file LICENSE","5.0.1",11,">= 3.0.0"
"treeDA","treeDA","Tree-Based Discriminant Analysis","0.0.2","GPL-2","6.0.1",11,">= 3.4.1"
"unpivotr","unpivotr","Unpivot Complex and Irregular Data Layouts","0.1.0","MIT + file LICENSE","5.0.1.9000",14,">= 3.2.0"
"catcont","catcont","Test for and Identify Categorical or Continuous Values","0.3.0","GPL-2 | file LICENSE","6.0.1.9000",1,">= 3.4.0"
"cellWise","cellWise","Analyzing Data with Cellwise Outliers","1.0.0","GPL (>= 2)",NA,10,">= 3.2.0"
"multinet","multinet","Analysis and Mining of Multilayer Social Networks","1.0","GPL",NA,4,NA
"phylogram","phylogram","Dendrograms for Evolutionary Analysis","1.0.0","GPL-3","6.0.1",8,">= 3.0.0"
"coreCT","coreCT","Programmatic Analysis of Sediment Cores Using Computed","1.1.2","GPL-3","6.0.1",6,">= 3.0"
"mosaicCore","mosaicCore","Common Utilities for Other MOSAIC-Family Packages","0.2.0","GPL (>= 2)","6.0.1.9000",8,">= 3.0.0"
"patternplot","patternplot","Versatile Pie Chart using Patterns, Colors, and Images","0.1","GPL","5.0.1",15,">= 3.0.2"
"RIA","RIA","Radiomics Image Analysis Toolbox for Grayscale Images","1.0.0","AGPL-3","5.0.1",1,">= 3.3.0"
"splot","splot","Split Plot","0.3.0","GPL (>= 2)","6.0.1",6,">= 3.1"
"hexSticker","hexSticker","Create Hexagon Sticker in R","0.1.0","Artistic-2.0","5.0.1",6,">= 3.3.0"
"KnowBR","KnowBR","Discriminating Well Surveyed Spatial Units from Exhaustive","1.1","GPL (>= 2)",NA,3,">= 3.0"
"subscreen","subscreen","Systematic Screening of Study Data for Subgroup Effects","0.2.2","GPL","6.0.1",9,NA
"BUCSS","BUCSS","Bias and Uncertainty Corrected Sample Size","0.0.1","GPL (>= 3)","5.0.1",1,NA
"fastDummies","fastDummies","Fast Creation of Dummy (Binary) Columns from Categorical","0.1.0","GPL","6.0.1",1,">= 2.10"
"googleLanguageR","googleLanguageR","Call Google's 'Natural Language' API, 'Cloud Translation' API","0.1.0","MIT + file LICENSE","6.0.1",16,">= 3.3.2"
"LEGIT","LEGIT","Latent Environmental & Genetic InTeraction (LEGIT) Model","1.0.0","GPL-3","5.0.1",5,NA
"mlrMBO","mlrMBO","A Toolbox for Model-Based Optimization of Expensive Black-Box","1.0.0","BSD_2_clause + file LICENSE","6.0.1",31,NA
"tidyxl","tidyxl","Read Untidy Excel Files","0.2.1","GPL-3","5.0.1.9000",6,">= 3.2.0"
"momentuHMM","momentuHMM","Maximum Likelihood Analysis of Animal Movement Behavior Using","1.0.0","GPL-3","6.0.1",29,">= 2.10"
"womblR","womblR","Spatiotemporal Boundary Detection Model for Areal Unit Data","1.0.0","GPL (>= 3)","5.0.1",12,">= 3.0.2"
"chinese.misc","chinese.misc","Miscellaneous Tools for Chinese Text Mining and More","0.1.0","GPL-3","5.0.1",5,">= 3.3.2"
"cstab","cstab","Selection of Number of Clusters via Normalized Clustering","0.2-1","GPL (>= 2)","5.0.1",4,">= 3.1.0"
"ggimage","ggimage","Use Image in 'ggplot2'","0.0.1","Artistic-2.0","5.0.1",6,">= 3.3.0"
"prodest","prodest","Production Function Estimation","0.1.1","GPL-3",NA,7,">= 2.10"
"rdiversity","rdiversity","Measurement and Partitioning of Similarity-Sensitive","1.0","GPL-3","6.0.1",13,NA
"spam64","spam64","64-Bit Extension of the SPArse Matrix R Package 'spam'","2.1-1","LGPL-2",NA,1,NA
"uptasticsearch","uptasticsearch","Get Data Frame Representations of 'Elasticsearch' Results","0.0.2","BSD_3_clause + file LICENSE","6.0.1",10,">= 3.3.0"
"ahnr","ahnr","An Implementation of the Artificial Hydrocarbon Networks","0.1.0","GPL-3 | file LICENSE","6.0.1",9,">= 3.3.0"
"asciiSetupReader","asciiSetupReader","Reads 'SPSS' and 'SAS' Files from ASCII Data Files (.txt) and","1.0","GPL","6.0.1",5,">= 2.10"
"bayeslm","bayeslm","Efficient Sampling for Gaussian Linear Regression with Arbitrary","0.1.0","LGPL (>= 2)",NA,3,">= 2.10"
"CircularDDM","CircularDDM","Circular Drift-Diffusion Model","0.0.7","GPL-2","6.0.1",3,">= 3.0.2"
"MetaComp","MetaComp","EDGE Taxonomy Assignments Visualization","1.0.1","GPL-2","6.0.1",7,">= 3.1.0"
"fuser","fuser","Fused Lasso for High-Dimensional Regression over Groups","1.0.0","GPL-3","6.0.1",11,">= 3.2.0"
"walrus","walrus","Robust Statistical Methods","1.0.0","GPL-3","6.0.1",5,NA
"AdhereR","AdhereR","Adherence to Medications","0.1.0","GPL (>= 2)","6.0.1",7,">= 3.0"
"bsamGP","bsamGP","Bayesian Spectral Analysis Models using Gaussian Process Priors","1.0.1","GPL (>= 2)","6.0.1",3,NA
"loder","loder","Dependency-Free Access to PNG Image Files","0.1.0","BSD_3_clause + file LICENCE","6.0.1",1,NA
"MultisiteMediation","MultisiteMediation","Causal Mediation Analysis in Multisite Trials","0.0.1","GPL-2","6.0.1",3,">= 3.1.0"
"prophet","prophet","Automatic Forecasting Procedure","0.1.1","BSD_3_clause + file LICENSE","5.0.1",14,">= 3.2.3"
"jpndistrict","jpndistrict","Create Japanese Administration Area and Office Maps","0.1.0","MIT + file LICENSE","5.0.1",24,">= 3.1.0"
"lingtypology","lingtypology","Linguistic Typology and Mapping","1.0.0","GPL (>= 2)","5.0.1",10,">= 2.10"
"tuckerR.mmgg","tuckerR.mmgg","Three-Mode Principal Components Analysis","1.5.0","GPL-3","5.0.1",2,">= 3.3.0"
"ROpenDota","ROpenDota","Access OpenDota Services in R","0.1.0","MIT + file LICENSE","6.0.1",2,">= 3.2.0"
"beginr","beginr","Functions for R Beginners","0.0.1","GPL","6.0.1",0,">= 3.1.0"
"diceR","diceR","Diverse Cluster Ensemble in R","0.1.0","MIT + file LICENSE","6.0.1.9000",35,">= 3.2.0"
"jwutil","jwutil","Tools for Data Manipulation and Testing","1.1.1","GPL-3","5.0.1",9,">= 3.0.0"
"leaflet.minicharts","leaflet.minicharts","Minicharts for Interactive Maps","0.1.0","GPL (>= 2) | file LICENSE","6.0.1",5,">= 2.10"
"manipulateWidget","manipulateWidget","Add Even More Interactivity to Interactive Charts","0.4.0","GPL (>= 2) | file LICENSE","5.0.1",10,NA
"ompr","ompr","Model and Solve Mixed Integer Linear Programs","0.6.0","GPL-3 | file LICENSE","6.0.1",6,">= 3.2.0"
"ompr.roi","ompr.roi","A Solver for 'ompr' that Uses the R Optimization Infrastructure","0.6.0","GPL-3","6.0.1",5,">= 3.2.0"
"rclimateca","rclimateca","Fetch Climate Data from Environment Canada","0.1","GPL-3","5.0.1",6,">= 2.10"
"StatCharrms","StatCharrms","Statistical Analysis of Chemistry, Histopathology, and","0.90.1","CC0","5.0.1",14,">= 3.1.0"
"teachingApps","teachingApps","Apps for Teaching Statistics, R Programming, and Shiny App","1.0.1","GPL (>= 2)","6.0.1",36,">= 3.1.0"
"odbc","odbc","Connect to ODBC Compatible Databases (using the DBI Interface)","1.0.0","MIT + file LICENSE","5.0.1.9000",10,NA
"bivrp","bivrp","Bivariate Residual Plots with Simulation Polygons","1.0","GPL (>= 2)",NA,5,">= 3.0.0"
"briskaR","briskaR","Biological Risk Assessment","0.1.0","GPL (>= 2) | file LICENSE","5.0.1",16,">=
        3.0.0"
"ConR","ConR","Computation of Parameters Used in Preliminary Assessment of","1.0","GPL-2",NA,13,">= 3.3"
"fst","fst","Lightning Fast Serialization of Data Frames for R","0.7.2","BSD_2_clause + file LICENSE","5.0.1",4,">= 3.0.0"
"LAM","LAM","Some Latent Variable Models","0.0-17","GPL (>= 2)",NA,12,">= 3.1"
"mixR","mixR","Finite Mixture Modeling for Raw and Binned Data","0.1.0","GPL (>= 2)","6.0.1",5,NA
"RegularizedSCA","RegularizedSCA","Regularized Simultaneous Component Based Data Integration","0.4.2","GPL (>= 2)","6.0.1",10,">= 2.10"
"textshape","textshape","Tools for Reshaping Text","0.2.0","GPL-2","5.0.1",5,">= 3.2.2"
"tigreBrowserWriter","tigreBrowserWriter","'tigreBrowser' Database Writer","0.1.2","AGPL-3","5.0.1",2,">= 2.14.0"
"wikilake","wikilake","Scrape Lakes Metadata Tables from Wikipedia","0.1","GPL (>= 2)","5.0.1",11,">= 3.3.2"
"SPAtest","SPAtest","Score Test Based on Saddlepoint Approximation","1.0.0","GPL (>= 2)",NA,0,">= 3.0.0"
"alterryx","alterryx","An 'API' Client for the 'Alteryx' Gallery","0.2.0","GPL-2","6.0.1",7,NA
"networktools","networktools","Assorted Tools for Identifying Important Nodes in Networks","1.0.0","GPL-3","6.0.1",14,">= 3.0.0"
"powerCompRisk","powerCompRisk","Power Analysis Tool for Joint Testing Hazards with Competing","0.1.0","GPL-2","6.0.1",2,">= 3.1.0"
"Tcomp","Tcomp","Data from the 2010 Tourism Forecasting Competition","1.0.0","GPL-3","5.0.1",7,">= 3.1.2"
"pkr","pkr","Pharmacokinetics in R","0.1.0","GPL-3",NA,3,">= 2.0.0"
"qrcmNP","qrcmNP","Nonlinear and Penalized Quantile Regression Coefficients","0.1.0","GPL-2","6.0.1",6,NA
"rwc","rwc","Random Walk Covariance Models","1.0","GPL-2",NA,4,">= 2.10"
"tangram","tangram","The Grammar of Tables","0.2.6","GPL-2","6.0.1",10,">= 3.2.3"
"excerptr","excerptr","Excerpt Structuring Comments from Your Code File and Set a Table","1.0.0","BSD_2_clause + file LICENSE","6.0.1",7,">= 3.3.2"
"LocalControl","LocalControl","An R Package for Generating High Quality","1.0.0","Apache License 2.0","6.0.1",7,">= 2.10"
"shinymaterial","shinymaterial","Implement Material Design in Shiny Applications","0.1.0","GPL-3 | file LICENSE","6.0.1",1,NA
"hmi","hmi","Hierarchical Multiple Imputation","0.6.3","GPL-3","6.0.1",18,">= 3.0.0"
"PSTR","PSTR","Panel Smooth Transition Regression Modelling","1.0.1","GPL-3","6.0.1",4,">= 3.0.0"
"sitreeE","sitreeE","Sitree Extensions","0.0-1","GPL (>= 2)",NA,1,">= 3.1.0"
"welchADF","welchADF","Welch-James Statistic for Robust Hypothesis Testing under","0.1","LGPL (>= 3)","6.0.1",0,NA
"metaforest","metaforest","Exploring Heterogeneity in Meta-Analysis using Random Forests","0.1.0","GPL-3","6.0.1",5,">= 3.4.1"
"redux","redux","R Bindings to 'hiredis'","1.0.0","GPL-2","6.0.1",5,">= 3.2.0"
"graphkernels","graphkernels","Graph Kernels","1.0","GPL (>= 2)",NA,4,NA
"purrrlyr","purrrlyr","Tools at the Intersection of 'purrr' and 'dplyr'","0.0.1","GPL-3 | file LICENSE","6.0.1",9,NA
"ramcmc","ramcmc","Robust Adaptive Metropolis Algorithm","0.1.0","GPL (>= 2)","5.0.1",5,NA
"RatingScaleReduction","RatingScaleReduction","Rating Scale Reduction Procedure","1.0","GPL-2",NA,2,NA
"RchivalTag","RchivalTag","Analyzing Archival Tagging Data","0.0.1","CC BY-NC-SA 4.0",NA,15,">= 3.0.1"
"rdwd","rdwd","Select and Download Climate Data from 'DWD' (German Weather","0.6.1","GPL (>= 2)","5.0.1",8,">= 2.10"
"StructFDR","StructFDR","False Discovery Control Procedure Integrating the Prior","1.0","GPL-2",NA,4,">= 3.1.0"
"DClusterm","DClusterm","Model-Based Detection of Disease Clusters","0.1","GPL-3","6.0.0",12,">= 2.10"
"joineRML","joineRML","Joint Modelling of Multivariate Longitudinal Data and","0.1.0","GPL-2 | file LICENSE","5.0.1",14,">= 3.1"
"qgam","qgam","Smooth Additive Quantile Regression Models","1.1.1","GPL (>= 2)","6.0.1",9,NA
"RHMS","RHMS","Hydrologic Modelling System for R Users","1.0","GPL-2",NA,4,">= 3.0.0"
"MetaLonDA","MetaLonDA","Metagenomics Longitudinal Differential Abundant Method","1.0.4","GPL-2","6.0.1",8,">= 3.1.2"
"aws.s3","aws.s3","AWS S3 Client Package","0.3.1","GPL (>= 2)","6.0.1",9,NA
"clampSeg","clampSeg","Idealisation of Patch Clamp Recordings","1.0-1","GPL-3",NA,6,">= 3.0.0"
"DisHet","DisHet","Estimate the Gene Expression Levels and Component Proportions of","0.1.0","GPL-2",NA,2,">= 2.15.0"
"edgarWebR","edgarWebR","SEC Filings Access","0.1.0","MIT + file LICENSE","6.0.1",10,">= 3.3.2"
"PeakSegOptimal","PeakSegOptimal","Optimal Segmentation Subject to Up-Down Constraints","2017.06.20","GPL-3",NA,5,">= 2.10"
"BiDAG","BiDAG","Software","1.0.0","GPL (>= 2)","6.0.1",6,NA
"DPP","DPP","Inference of Parameters of Normal Distributions from a Mixture","0.1.0","MIT + file LICENSE","6.0.1",4,NA
"lvec","lvec","Out of Memory Vectors","0.1.0","GPL-3","6.0.1",3,">= 3.0.0"
"neurohcp","neurohcp","Human Connectome Project Interface","0.6","GPL-2","6.0.1",8,NA
"bssm","bssm","Bayesian Inference of State Space Models","0.1.0","GPL (>= 2)","6.0.1",13,">= 3.1.3"
"frailtyEM","frailtyEM","Fitting Frailty Models with the EM Algorithm","0.5.2","GPL (>= 2)","6.0.1",13,NA
"ukbtools","ukbtools","Manipulate and Explore UK Biobank Data","0.9.0","GPL-2","6.0.1",9,">= 2.10"
"unsystation","unsystation","Stationarity Test Based on Unsystematic Sub-Sampling","0.1.0","GPL-2","5.0.1",8,NA
"ALA4R","ALA4R","Atlas of Living Australia (ALA) Data and Resources in R","1.5.3","MPL-2.0","5.0.1",23,NA
"genotypeR","genotypeR","SNP Genotype Marker Design and Analysis","0.0.1.6","GPL (>= 3)","6.0.1",10,">= 3.3.2"
"ICtest","ICtest","Estimating and Testing the Number of Interesting Components in","0.2","GPL (>= 2)",NA,14,NA
"margins","margins","Marginal Effects for Model Objects","0.3.0","MIT + file LICENSE","6.0.1",11,NA
"microPop","microPop","Modelling Microbial Populations","1.0","GPL-3 | file LICENSE","5.0.1",1,"*"
"philentropy","philentropy","Similarity and Distance Quantification Between Probability","0.0.1","GPL-2","6.0.1",6,">= 3.1.2"
"prediction","prediction","Tidy, Type-Safe 'prediction()' Methods","0.1.1","MIT + file LICENSE","5.0.1",6,NA
"quadprogXT","quadprogXT","Quadratic Programming with Absolute Value Constraints","0.0.1","GPL (>= 2)","6.0.1",2,">= 3.3.2"
"regnet","regnet","Network-Based Regularization for Generalized Linear Models","0.1.0","GPL-2","6.0.1",2,">= 3.1.0"
"templates","templates","A System for Working with Templates","0.1.0","MIT + file LICENSE","5.0.1",9,">= 3.3.1"
"ziphsmm","ziphsmm","Zero-Inflated Poisson Hidden (Semi-)Markov Models","1.0.0","GPL","5.0.1",3,">= 3.1.0"
"AIG","AIG","Automatic Item Generator","0.1.0","GPL-3","5.0.1",3,NA
"easycsv","easycsv","Load Multiple 'csv' and 'txt' Tables","1.0.1","GPL-2","6.0.1",0,">= 3.2.3"
"kableExtra","kableExtra","Construct Complex Table with 'Kable' and Pipe Syntax","0.1.0","MIT + file LICENSE","6.0.1",7,">= 3.1.2"
"tabularaster","tabularaster","Tidy Tools for 'Raster' Data","0.3.0","GPL-3","6.0.1",14,">= 3.2.5"
"MAVE","MAVE","Methods for Dimension Reduction","0.1.6","GPL (>= 2)","5.0.1",4,NA
"HURDAT","HURDAT","Hurricane Re-Analysis Project","0.1.0","MIT + file LICENSE","6.0.1",12,">= 3.4.0"
"kutils","kutils","Project Management Tools","0.91","GPL-2","5.0.1",8,">= 2.10"
"StepSignalMargiLike","StepSignalMargiLike","Step-Wise Signal Extraction via Marginal Likelihood","2.5.9","GPL (>= 2)",NA,2,NA
