"","pkg_name","title","pkg_ver","license","roxygen","n_depends","rversion"
"gcite","gcite","Google Citation Parser","0.6","GPL","6.0.1",9,NA
"EdSurvey","EdSurvey","Education Survey","1.0.5","GPL-2","6.0.1",10,">= 3.2.0"
"fdq","fdq","Forest Data Quality","0.1","GPL-3","5.0.1",8,">= 3.0"
"RBesT","RBesT","R Bayesian Evidence Synthesis Tools","1.2-2","GPL (>= 3) | file LICENSE","6.0.1",24,">= 3.2.0"
"recipes","recipes","Preprocessing Tools to Create Design Matrices","0.1.0","GPL-2","6.0.1",24,">= 3.2.3"
"tensorflow","tensorflow","R Interface to TensorFlow","0.7","Apache License 2.0","6.0.1",4,">= 3.0"
"BART","BART","Bayesian Additive Regression Trees","1.0","GPL (>= 2)",NA,5,">= 2.10"
"cleanNLP","cleanNLP","A Tidy Data Model for Natural Language Processing","0.24","GPL-3","5.0.1",5,">= 2.10"
"lvnet","lvnet","Latent Variable Network Modeling","0.2","GPL-2",NA,11,NA
"pinbasic","pinbasic","Fast and Stable Estimation of the Probability of Informed","0.1.0","GPL-3 | file LICENSE","5.0.1",6,">= 3.1"
"RcppMsgPack","RcppMsgPack","'MsgPack' C++ Header Files","0.1.1","GPL (>= 2)","5.0.1",2,NA
"SpaDES.core","SpaDES.core","Core Utilities for Developing and Running Spatially Explicit","0.1.0","GPL-3","6.0.1",38,">= 3.3.2"
"valr","valr","Genome Interval Arithmetic in R","0.1.0","MIT + file LICENSE","5.0.1",20,">= 3.1.2"
"ggeffects","ggeffects","Create Tidy Data Frames of Marginal Effects for 'ggplot' from","0.1.0","GPL-3","6.0.1",16,">= 3.2"
"wTO","wTO","Computing Weighted Topological Overlaps (wTO) & Consensus wTO","1.1.0","GPL-2","6.0.1",7,NA
"ems","ems","Epimed Solutions Collection for Data Editing, Analysis, and","0.3.1.6","GPL (>= 2)","5.0.1",0,">= 3.3.1"
"GENEAclassify","GENEAclassify","Segmentation and Classification of Accelerometer Data","1.4.5","GPL","6.0.1",11,">= 2.14.0"
"jmv","jmv","The 'jamovi' Analyses","0.7.0.3","GPL (>= 2)","5.0.1",15,">= 3.2"
"reproducible","reproducible","A Set of Tools that Enhance Reproducibility Beyond Package","0.1.1","GPL-3","6.0.1",15,">= 3.3.2"
"canvasXpress","canvasXpress","Visualization Package for CanvasXpress in R","0.14.7","GPL-3","5.0.1",8,">= 3.2.1"
"divest","divest","Get Images Out of DICOM Format Quickly","0.1.0","BSD_3_clause + file LICENCE","5.0.1",5,NA
"FRegSigCom","FRegSigCom","Functional Regression using Signal Compression Approach","0.1.0","GPL-2","6.0.1.9000",3,NA
"hommel","hommel","Methods for Closed Testing with Simes Inequality, in Particular","1.0","GPL (>= 2)",NA,3,NA
"pkggraph","pkggraph","A Consistent and Intuitive Platform to Explore the Dependencies","0.2.0","GPL-3","6.0.1",21,">= 3.4.0"
"POUMM","POUMM","The Phylogenetic Ornstein-Uhlenbeck Mixed Model","1.2.1","GPL (>= 3.0)","5.0.1",21,">= 3.1.0"
"Rdimtools","Rdimtools","Dimension Reduction and Estimation Methods","0.1.0","GPL (>= 3)","6.0.1",7,NA
"wrapr","wrapr","Wrap R Functions for Debugging and Ease of Use","0.1.0","GPL-3","5.0.1",3,NA
"DescToolsAddIns","DescToolsAddIns","Some Functions to be Used as Shortcuts in 'RStudio'","0.9.1","GPL (>= 2)",NA,4,">= 3.1.1"
"giphyr","giphyr","R Interface to the 'Giphy' 'API'","0.1.0","MIT + file LICENSE","6.0.1",7,">= 3.2.2"
"GJRM","GJRM","Generalised Joint Regression Modelling","0.1-1","GPL (>= 2)",NA,20,">= 3.2.1"
"LNIRT","LNIRT","LogNormal Response Time Item Response Theory Models","0.1.0","GPL-2 | GPL-3","5.0.1",3,NA
"mnreadR","mnreadR","MNREAD Parameters Estimation","0.1.0","GPL-2","6.0.1",2,">= 2.10"
"palm","palm","Fitting Point Process Models via the Palm Likelihood","1.0.0","GPL","5.0.1",8,">= 3.0.0"
"personalized","personalized","Estimation and Validation Methods for Subgroup Identification","0.0.2","GPL-2","6.0.1",7,NA
"configr","configr","An Implementation of Parsing and Writing Configuration File","0.0.2","MIT + file LICENSE","5.0.1",10,">= 3.2.1"
"dimRed","dimRed","A Framework for Dimensionality Reduction","0.0.3","GPL-3 | file LICENSE","5.0.1",25,">= 3.0.0"
"helixvis","helixvis","Visualize Alpha-Helical Peptide Sequences","0.1.0","GPL-3","6.0.1",3,">= 3.2.5"
"skpr","skpr","Generate and Evaluate Optimal","0.35.1","GPL-3","6.0.1",15,">= 3.0.2"
"sys","sys","Portable System Utilities","1.0","MIT + file LICENSE","5.0.1.9000",1,NA
"fastLink","fastLink","Fast Probabilistic Record Linkage with Missing Data","0.1.0","GPL (>= 3)","5.0.1",16,">= 3.1.0"
"fingertipsR","fingertipsR","Fingertips Data for Public Health","0.1.0","GPL-3","6.0.1",10,NA
"FSelectorRcpp","FSelectorRcpp","'Rcpp' Implementation of 'FSelector' Entropy-Based Feature","0.1.0","GPL-2","6.0.1.9000",30,">= 3.3.2"
"reqres","reqres","Powerful Classes for HTTP Requests and Responses","0.2.0","MIT + file LICENSE","6.0.1",13,">= 2.10"
"STARTS","STARTS","Functions for the STARTS Model","0.0-9","GPL (>= 2)",NA,5,">= 3.1"
"AMCTestmakeR","AMCTestmakeR","Generate LaTeX Code for Auto-Multiple-Choice (AMC)","0.1.0","GPL-3","6.0.1",2,NA
"nandb","nandb","Number and Brightness Image Analysis","0.2.0","BSD_3_clause + file LICENSE","6.0.1",29,"*"
"Rcrawler","Rcrawler","Web Crawler and Scraper","0.1.1","MIT + file LICENSE","6.0.1",7,NA
"reportReg","reportReg","An Easy Way to Report Regression Analysis","0.1.0","GPL-3",NA,0,NA
"aphid","aphid","Analysis with Profile Hidden Markov Models","1.0.0","GPL-3","6.0.1",10,">= 3.0.0"
"gastempt","gastempt","Analyzing Gastric Emptying from MRI or Scintigraphy","0.4.01","GPL (>= 3)","6.0.1",19,">= 3.4.0"
"antiword","antiword","Extract Text from Microsoft Word Documents","1.0","GPL-2","6.0.1",1,NA
"arsenal","arsenal","An Arsenal of 'R' Functions for Large-Scale Statistical","0.1.2","GPL (>= 2)","5.0.1",13,">= 3.2.0"
"dtangle","dtangle","Cell Type Deconvolution from Gene Expressions","0.1.0","GPL-3","6.0.1",3,">= 2.10.0"
"httptest","httptest","A Test Environment for HTTP Requests","1.0.0","MIT + file LICENSE","5.0.1",4,">= 3.0.0"
"idefix","idefix","Efficient Designs for Discrete Choice Experiments","0.1.0","GPL-3","6.0.1",6,">= 3.1.1"
"MALDIrppa","MALDIrppa","MALDI Mass Spectrometry Data Robust Pre-Processing and Analysis","1.0.0","GPL (>= 2)",NA,8,">= 3.2.5"
"quickPlot","quickPlot","A System of Plotting Optimized for Speed and Modularity","0.1.1","GPL-3","6.0.1",17,">= 3.3.3"
"survHE","survHE","Survival Analysis in Health Economic Evaluation","1.0.4","GPL (>= 2)","6.0.1",14,">= 3.0.2"
"unrtf","unrtf","Extract Text from Rich Text Format (RTF) Documents","1.0","GPL-3","6.0.1",1,NA
"walker","walker","Efficient Bayesian Linear Regression with Time-Varying","0.1.0","GPL (>= 2)","6.0.1",11,">= 3.0.2"
"MADPop","MADPop","MHC Allele-Based Differencing Between Populations","1.1.1","GPL-3","6.1.0",13,">= 3.4.0"
"memapp","memapp","The Moving Epidemics Method Shiny Web Application","2.0","GPL (>= 2)","6.0.1",22,">= 3.4.0"
"breathteststan","breathteststan","Stan-Based Fit to Gastric Emptying Curves","0.3.0","GPL-3","6.0.1",17,">= 3.4.0"
"elasticsearchr","elasticsearchr","A Lightweight Interface for Interacting with Elasticsearch from","0.1.0","Apache License 2.0","5.0.1",5,NA
"exampletestr","exampletestr","Help for Writing Tests Based on Function Examples","0.3.0","GPL-3","6.0.1",9,NA
"gggenes","gggenes","Draw Gene Arrow Maps in 'ggplot2'","0.2.0","GPL-2","6.0.1",5,">= 3.3.2"
"huxtable","huxtable","Simply Create LaTeX and HTML Tables","0.1.0","MIT + file LICENSE","6.0.1",7,NA
"worrms","worrms","World Register of Marine Species (WoRMS) Client","0.1.0","MIT + file LICENSE","5.0.1",8,NA
"mdmb","mdmb","Model Based Treatment of Missing Data","0.1-0","GPL (>= 2)",NA,9,">= 3.1"
"webmockr","webmockr","Stubbing and Setting Expectations on 'HTTP' Requests","0.1.0","MIT + file LICENSE","6.0.1",9,NA
"WVPlots","WVPlots","Common Plots for Analysis","0.2.0","GPL-3","5.0.1",11,NA
"augSIMEX","augSIMEX","Analysis of Data with Mixed Measurement Error and","1.0","GPL (>= 2)",NA,6,NA
"autothresholdr","autothresholdr","An R Port of the 'ImageJ' Plugin 'Auto Threshold'","0.2.0","GPL-3","6.0.1",8,NA
"eulerr","eulerr","Area-Proportional Euler Diagrams","0.1.0","GPL-3","5.0.1",10,">= 3.3.1"
"jmvcore","jmvcore","Dependencies for the 'jamovi' Framework","0.2.2","GPL (>= 2)","5.0.1",5,">= 3.2"
"semtree","semtree","Recursive Partitioning for Structural Equation Models","0.9.9","GPL-3",NA,8,NA
"sessioninfo","sessioninfo","R Session Information","1.0.0","GPL-2","6.0.1.9000",7,NA
"shinyWidgets","shinyWidgets","Custom Inputs Widgets for Shiny","0.2.0","GPL-3 | file LICENSE","6.0.1",5,">= 3.2.0"
"spant","spant","MR Spectroscopy Analysis Tools","0.1.0","GPL-3","6.0.1",29,">= 2.10"
"KarsTS","KarsTS","An Interface for Karstic Time Series","1.0","GPL (>= 2)","6.0.1",20,NA
"sigr","sigr","Format Significance Summaries for Reports","0.1.3","GPL-3","5.0.1",4,NA
"egg","egg","Extensions for 'ggplot2', to Align Plots, and Set Panel Sizes","0.2.0","GPL-3","6.0.1",8,NA
"numform","numform","Tools to Format Numbers for Publication","0.0.4","GPL-2","6.0.1",1,">= 3.2.0"
"owmr","owmr","OpenWeatherMap API Wrapper","0.7.2","MIT + file LICENSE","5.0.1",7,">= 3.1.2"
"tidyRSS","tidyRSS","Tidy RSS for R","1.0.0","MIT + file LICENSE","6.0.0",9,">= 2.10"
"dexter","dexter","Data Management and Basic Analysis of Tests","0.1.7","GPL (>= 2)","5.0.1",9,">= 2.10"
"redlistr","redlistr","Tools for the IUCN Red List of Ecosystems and Species","1.0.0","GPL (>= 3)","6.0.1",11,">= 3.3.3"
"tesseract","tesseract","Open Source OCR Engine","1.0","MIT + file LICENSE","5.0.1.9000",6,NA
"VARtests","VARtests","Tests for Error Autocorrelation and ARCH Errors in Vector","1.0.1","GPL (>= 3)",NA,5,">= 3.0.2"
"hutils","hutils","Miscellaneous R Functions and Aliases","0.1.2","GPL-3","6.0.1",4,NA
"incidence","incidence","Compute, Handle, Plot and Model Incidence of Dated Events","1.0.0","MIT + file LICENSE","5.0.1",7,NA
"automultinomial","automultinomial","Autologistic and Automultinomial Spatial Regression and Variable","1.0.0","GPL-2 | GPL-3","5.0.1",11,">= 3.2.0"
"flextable","flextable","Tabular Reporting API","0.1.0","GPL-3","6.0.1",17,NA
"gibble","gibble","Component Geometry Decomposition","0.0.1","GPL-3","6.0.1",3,">= 3.3.1"
"mvord","mvord","Multivariate Ordinal Regression Models","0.0.1","GPL-3","6.0.1",4,">= 3.1.0"
"RATest","RATest","Randomization Tests","0.1.0","GPL (>= 2)","6.0.1",6,">= 3.00"
"restriktor","restriktor","Restricted Statistical Estimation and Inference for Linear","0.1-55","GPL (>= 2)",NA,6,">= 3.0.0"
"shallot","shallot","Random Partition Distribution Indexed by Pairwise Information","0.3.1","Apache License 2.0 | file LICENSE",NA,2,NA
"spatstat.utils","spatstat.utils","Experimental Subset of 'spatstat' Utilities","1.2-8","GPL (>= 2)",NA,6,">= 3.3.0"
"AMModels","AMModels","Adaptive Management Model Manager","0.1.1","GPL-3","5.0.1",6,NA
"cpt","cpt","Classification Permutation Test","0.9","GPL",NA,3,NA
"filesstrings","filesstrings","Handy String and File Manipulation","0.3.1","GPL-3","6.0.1",14,NA
"GDINA","GDINA","The Generalized DINA Model Framework","1.0.0","GPL-3","5.0.1",15,">= 3.1.0"
"greta","greta","Simple and Scalable Statistical Modelling in R","0.2.0","Apache License 2.0","6.0.1",16,">= 3.0"
"lemon","lemon","Freshing Up your 'ggplot2' Plots","0.3.0","GPL-3","5.0.1",10,">= 3.1.0"
"vennLasso","vennLasso","Variable Selection for Heterogeneous Populations","0.1.1","GPL (>= 2)","6.0.1",14,">= 3.2.0"
"rsparkling","rsparkling","R Interface for H2O Sparkling Water","0.1.0","Apache License 2.0 | file LICENSE","5.0.1",5,NA
"strip","strip","Lighten your R Model Outputs","0.1.1","MIT + file LICENSE","5.0.1",9,">= 3.1.3"
"atus","atus","American Time Use Survey Data","0.1","GPL (>= 2)","5.0.1",0,">= 2.10"
"ebimetagenomics","ebimetagenomics","EBI Metagenomics Portal","0.2","LGPL-3",NA,3,">= 3.0.0"
"spectrolab","spectrolab","Class and Methods for Hyperspectral Data","0.0.2","GPL-3","6.0.1",10,">= 3.4"
"sugrrants","sugrrants","Supporting Graphs for Analysing Time Series","0.1.0","GPL (>= 3)","6.0.1",15,">= 3.1.3"
"uavRmp","uavRmp","UAV Mission Planner","0.5.1","GPL (>= 3) | file LICENSE","6.0.1",22,">= 3.1.0"
"vistime","vistime","Interactive R Timelines using 'plotly.js'","0.1.0","GPL-3 | file LICENSE","5.0.1",2,">= 3.1.0"
"ggspatial","ggspatial","Spatial Data Framework for ggplot2","0.2.1","GPL-3","5.0.1",13,">= 2.10"
"BayesS5","BayesS5","Bayesian Variable Selection Using Simplified Shotgun Stochastic","1.22","GPL (>= 2)",NA,4,">= 3.2.4"
"commonsMath","commonsMath","JAR Files of the Apache Commons Mathematics Library","1.0.0","Apache License 2.0 | file LICENSE",NA,2,NA
"drake","drake","Data Frames in R for Make","1.0.1","GPL-3","5.0.1",19,">= 3.2.0"
"latexpdf","latexpdf","Convert Tables to PDF","0.1.2","GPL-3","6.0.1",0,NA
"link2GI","link2GI","Linking GIS, Remote Sensing and Other Command Line Tools","0.1-0","GPL (>= 3) | file LICENSE","5.0.1",10,">= 2.10"
"electoral","electoral","Allocating Seats Methods and Party System Scores","0.1.0","GPL-3","6.0.1",3,NA
"JuliaCall","JuliaCall","Seamless Integration Between R and 'Julia'","0.7.3","MIT + file LICENSE","6.0.1",3,">= 3.2.0"
"microdemic","microdemic","'Microsoft Academic' API Client","0.1.0","MIT + file LICENSE","6.0.1",6,NA
"MODIS","MODIS","Acquisition and Processing of MODIS Products","1.0.0","GPL (>= 3) | file LICENSE","5.0.1",16,">= 2.10"
"PhenotypeSimulator","PhenotypeSimulator","Flexible Phenotype Simulation from Different Genetic and Noise","0.1.1","MIT + file LICENSE","6.0.1",11,">= 3.3.2"
"reactR","reactR","React Helpers","0.1.0","BSD_3_clause + file LICENSE","5.0.1",6,NA
"rlang","rlang","Functions for Base Types and Core R and 'Tidyverse' Features","0.1.1","GPL-3","6.0.1",4,">= 3.1.0"
"rlas","rlas","Read and Write 'las' and 'laz' Binary File Formats","1.0.2","GPL-3","5.0.1",3,">= 3.0.0"
"sitree","sitree","Single Tree Simulator","0.1-0","GPL (>= 2)",NA,4,">= 3.1.0"
"solvebio","solvebio","The Official SolveBio API Client for R","0.1.3","MIT + file LICENSE","5.0.1",2,NA
"texPreview","texPreview","Compile and Preview Snippets of 'LaTeX' in 'RStudio'","1.0.0","GPL-2 | GPL-3","6.0.1",8,">= 2.3.0"
"CrossVA","CrossVA","Verbal Autopsy Data Transform for Use with Various Coding","0.9.0","GPL-2","5.0.1",1,">= 3.2.0"
"d3r","d3r","'d3.js' Utilities for R","0.4.0","BSD_3_clause + file LICENSE","5.0.1",12,NA
"dodgr","dodgr","Distances on Directed Graphs","0.0.1","GPL-3","6.0.1",17,">= 3.2.0"
"mmpf","mmpf","Monte-Carlo Methods for Prediction Functions","0.0.1","MIT + file LICENSE","5.0.1",5,NA
"mvLSW","mvLSW","Multivariate Locally Stationary Wavelet Analysis","1.0","GPL (>= 3)",NA,2,">= 3.2"
"NetworkInference","NetworkInference","Inferring Latent Diffusion Networks","1.0.0","MIT + file LICENSE","6.0.1",13,NA
"rsMove","rsMove","Remote Sensing for Movement Ecology","0.1","GPL (>= 2)","6.0.1",5,NA
"rWind","rWind","Download, Edit and Transform Wind Data from GFS","0.1.3","GPL (>= 3)",NA,2,">= 2.10"
"sf","sf","Simple Features for R","0.2-0","GPL-2 | MIT + file LICENSE","5.0.1",15,">= 3.0.0"
"taskscheduleR","taskscheduleR","Schedule R Scripts and Processes with the Windows Task Scheduler","1.0","AGPL-3","5.0.1",6,NA
"trackdem","trackdem","Particle Tracking and Demography","0.1","GPL-2","6.0.1",11,NA
"blogdown","blogdown","Create Blogs and Websites with R Markdown","0.1","GPL-3","6.0.1",17,NA
"DEploid","DEploid","Deconvolute Mixed Genomes with Unknown Proportions","0.3.2","GPL (>= 3)","5.0.1",5,">= 3.1.0"
"isdparser","isdparser","Parse 'NOAA' Integrated Surface Data Files","0.1.0","MIT + file LICENSE","5.0.1",7,NA
"websearchr","websearchr","Access Domains and Search Popular Websites","0.0.1","MIT + file LICENSE","6.0.1",3,">= 3.4.1"
"xaringan","xaringan","Presentation Ninja","0.1","MIT + file LICENSE","5.0.1",6,NA
"bikedata","bikedata","Download and Aggregate Data from Public Hire Bicycle Systems","0.0.1","GPL-3","6.0.1",15,">= 3.0"
"dLagM","dLagM","Time Series Regression Models with Distributed Lag Models","0.0.7","GPL-3","6.0.1",5,NA
"dynamichazard","dynamichazard","Dynamic Hazard Models using State Space Models","0.1.0","GPL-2","5.0.1",19,NA
"FishResp","FishResp","An Analytical Tool for Aquatic Respirometry","0.1.0","GPL-3","6.0.1",2,">= 3.0.0"
"meteoland","meteoland","Landscape Meteorology Tools","0.4.3","GPL (>= 2)",NA,9,">= 2.10"
"osmdata","osmdata","Import OpenStreetMap Data as Simple Features or Spatial Objects","0.0.0","GPL-3","6.0.1",18,">= 3.2.4"
"bridgesampling","bridgesampling","Bridge Sampling for Marginal Likelihoods and Bayes Factors","0.1-1","GPL (>= 2)","6.0.1",14,">= 3.0.0"
"cdata","cdata","spread()'","0.1.0","GPL-3","6.0.1",8,NA
"RApiDatetime","RApiDatetime","R API Datetime","0.0.1","GPL (>= 2)","6.0.1",0,NA
"lexicon","lexicon","Lexicons","0.0.1","MIT + file LICENSE","5.0.1",0,">= 3.2.2"
"ciTools","ciTools","Confidence or Prediction Intervals, Quantiles, and Probabilities","0.1.0","GPL (>= 3)","6.0.1",8,NA
"poliscidata","poliscidata","Datasets and Functions Featured in Pollock and Edwards R","1.2.0","CC0","5.0.1",17,">= 2.10"
"webTRISr","webTRISr","A Wrapper Around 'WebTRIS' Traffic Flow API from Highways","0.1.0","GPL-3","6.0.1",11,NA
"wikitaxa","wikitaxa","Taxonomic Information from 'Wikipedia'","0.1.0","MIT + file LICENSE","6.0.1",11,">= 3.2.1"
"xtensor","xtensor","Headers for the 'xtensor' Library","0.1.0-0","BSD_3_clause + file LICENSE",NA,2,NA
"antaresRead","antaresRead","Import, Manipulate and Explore the Results of an Antares","1.1.1","GPL (>= 2) | file LICENSE","6.0.0",9,NA
"bsplinePsd","bsplinePsd","Bayesian Nonparametric Spectral Density Estimation Using","0.1.0","GPL (>= 3)","6.0.1",3,NA
"charlatan","charlatan","Make Fake Data","0.1.0","MIT + file LICENSE","6.0.1",7,NA
"evaluator","evaluator","Information Security Quantified Risk Assessment Toolkit","0.1.0","MIT + file LICENSE","6.0.1",24,">= 3.3.2"
"hNMF","hNMF","Hierarchical Non-Negative Matrix Factorization","0.2","GPL-3","6.0.0",11,">= 3.3.2"
"PowerUpR","PowerUpR","Power Analysis Tools for Individual/Cluster Randomized Trials","0.1.2","GPL (>= 3)",NA,1,NA
"PWEALL","PWEALL","Design and Monitoring of Survival Trials Accounting for Complex","1.0.0","GPL (>= 2)","5.0.1",2,">= 3.1.2"
"sdpt3r","sdpt3r","Semi-Definite Quadratic Linear Programming Solver","0.1","GPL-2 | GPL-3","5.0.1",3,">= 2.10"
"BimodalIndex","BimodalIndex","The Bimodality Index","1.1.5","Apache License (== 2.0)",NA,3,">= 3.0"
"breathtestcore","breathtestcore","Core Functions to Read and Fit 13c Time Series from Breath Tests","0.3.0","GPL-3","6.0.1",17,">= 3.4.0"
"clickR","clickR","Fix Data and Create Report Tables from Different Objects","0.1.8","GPL (>= 2)","5.0.1",9,NA
"dataPreparation","dataPreparation","Automated Data Preparation","0.1","GPL-3 | file LICENSE","6.0.1",8,">= 3.3.0"
"fergm","fergm","Estimation and Fit Assessment of Frailty Exponential Random","0.2.0","GPL-3","6.0.1.9000",14,">= 3.3.3"
"GenAlgo","GenAlgo","Classes and Methods to Use Genetic Algorithms for Feature","2.1.3","Apache License (== 2.0)",NA,7,">= 3.0"
"pinyin","pinyin","Convert Chinese Characters into Pinyin","1.0.2","GPL","6.0.1",0,">= 3.1.0"
"pivottabler","pivottabler","Create Pivot Tables in R","0.1.0","GPL-3","6.0.1",12,">= 3.2.0"
"bcROCsurface","bcROCsurface","Bias-Corrected Methods for Estimating the ROC Surface of","1.0-1","GPL (>= 2)","5.0.1",12,">= 2.15.0"
"bookdownplus","bookdownplus","Generate Varied Books and Documents with R 'bookdown' Package","1.0.2","GPL","6.0.1",3,">= 3.1.0"
"grattan","grattan","Perform Common Quantitative Tasks for Australian Analysts and to","1.3.0.3","GPL-2","5.0.1",23,">= 2.10"
"queuecomputer","queuecomputer","Computationally Efficient Queue Simulation","0.5.1","GPL (>= 2)","5.0.1.9000",10,">= 3.3.1"
"cosinor2","cosinor2","Extended Tools for Cosinor Analysis of Rhythms","0.1.0","GPL-3","6.0.1",4,">= 2.10"
"crminer","crminer","Fetch 'Scholary' Full Text from 'Crossref'","0.1.0","MIT + file LICENSE","6.0.1",8,NA
"define","define","Create FDA-Style Data and Program Definitions","0.2.5","GPL-3","6.0.1",5,NA
"dendroTools","dendroTools","Nonlinear Methods for Analyzing Dendroclimatological Data","0.0.3","GPL-3","6.0.1",14,">= 3.4"
"dslabs","dslabs","Data Science Labs","0.0.1","Artistic-2.0","5.0.1",0,">= 3.3.1"
"readJDX","readJDX","Import Data in the JCAMP-DX Format","0.2.3","GPL (>= 3)","5.0.1",2,">= 3.0"
"stormwindmodel","stormwindmodel","Model Tropical Cyclone Wind Speeds","0.1.0","GPL-2","5.0.1",16,">= 2.10"
"analytics","analytics","Regression Outlier Detection and Other Tools for Data Analysis","1.0","GPL-2","5.0.1",4,">= 3.1.0"
"touch","touch","Tools of Utilization and Cost in Healthcare","0.1-3","GPL (>= 3)","5.0.1",1,">= 3.2.0"
"GSED","GSED","Group Sequential Enrichment Design","1.0","GPL-3",NA,3,">= 3.1.2"
"hoardr","hoardr","Manage Cached Files","0.1.0","MIT + file LICENSE","6.0.1",6,NA
"psychmeta","psychmeta","Psychometric Meta-Analysis Toolkit","0.1.0","GPL (>= 3)","6.0.1",9,NA
"Rnightlights","Rnightlights","Satellite Nightlight Data Extraction","0.1.0","GPL-3","6.0.1",31,"*"
"treemapify","treemapify","Draw Treemaps in 'ggplot2'","2.3.2","GPL (>= 3)","6.0.1",8,">= 3.4.1"
"bamlss","bamlss","Bayesian Additive Models for Location Scale and Shape (and","0.1-1","GPL-2 | GPL-3",NA,27,">= 3.2.3"
"mMPA","mMPA","Implementation of Marker-Assisted Mini-Pooling with Algorithm","0.1.0","MIT + file LICENSE","6.0.1",2,NA
"mrfDepth","mrfDepth","Depth Measures in Multivariate, Regression and Functional","1.0.1","GPL (>= 2)",NA,8,">= 3.3.0"
"antaresViz","antaresViz","Antares Visualizations","0.8","GPL (>= 2) | file LICENSE","6.0.1",22,NA
"BatchGetSymbols","BatchGetSymbols","Downloads and Organizes Financial Data for Multiple Tickers","1.0","GPL-2","5.0.1",9,">= 3.3.2"
"FLightR","FLightR","Hidden Markov Model for Solar Geolocation Archival Tags","0.4.5","GPL-3","5.0.1",21,">= 3.0.2"
"GetLattesData","GetLattesData","Reading Bibliometric Data from Lattes Platform","0.5","GPL-2","6.0.1",10,">= 3.3.0"
"GROAN","GROAN","Genomic Regression Workbench","1.0.0","GPL-3 | file LICENSE","6.0.1",8,">= 2.10"
"itunesr","itunesr","Access iTunes App Store Ratings and Reviews using R","0.1.1","CC0","6.0.1",6,NA
"partialCI","partialCI","Partial Cointegration","1.1.0","GPL-2 | GPL-3","6.0.1",16,NA
"Rodam","Rodam","Wrapper Functions for 'ODAM' (Open Data for Access and Mining)","0.1.2","LGPL (>= 3)","5.0.1",4,">= 3.1.1"
"stacomiR","stacomiR","Fish Migration Monitoring","0.5.3.1","GPL (>= 2)","5.0.1",26,">= 3.0.0"
"tidyselect","tidyselect","Select from a Set of Strings","0.1.1","GPL-3","6.0.1",5,">= 3.1.0"
"airGR","airGR","Suite of GR Hydrological Models for Precipitation-Runoff","1.0.5.12","GPL-2",NA,1,">= 3.0.1"
"emdi","emdi","Estimating and Mapping Disaggregated Indicators","1.0.0","GPL-2","5.0.1",17,">= 3.3.0"
"NetworkChange","NetworkChange","Bayesian Package for Network Changepoint Analysis","0.1","GPL-3","5.0.1",11,">= 2.10.0"
"wooldridge","wooldridge","A Modern","1.0.1","GPL-3","6.0.1",7,">= 3.4.0"
"EFAutilities","EFAutilities","Utility Functions for Exploratory Factor Analysis","0.1.0","GPL-2","5.0.1",2,">= 2.10"
"mindr","mindr","Convert Files Between Markdown or Rmarkdown Files and Mindmaps","1.0.4","GPL","6.0.1",0,">= 3.0.0"
"nucim","nucim","Nucleus Imaging Toolbox","0.5.3","GPL-3","5.0.1",4,">= 3.0.0"
"billboarder","billboarder","Create Interactive Chart with the JavaScript 'Billboard' Library","0.0.3","MIT + file LICENSE","6.0.1",10,">= 3.3.2"
"c212","c212","Methods for Detecting Safety Signals in Clinical Trials Using","0.90","GPL (>= 2)",NA,1,NA
"easyreg","easyreg","Easy Regression","1.0","GPL (>= 2)",NA,2,">= 3.0.0"
"psda","psda","Polygonal Symbolic Data Analysis","1.0.0","GPL-2","6.0.1",7,">= 3.1"
"sptemExp","sptemExp","Constrained Spatiotemporal Mixed Models for Exposure Estimation","0.1.0","GPL","6.0.1",22,">= 2.14"
"pollen","pollen","Tools for Working with Aerobiological Data","0.40","MIT + file LICENSE","5.0.1",4,NA
"ratelimitr","ratelimitr","Rate Limiting for R","0.3.6","MIT + file LICENSE","5.0.1",5,NA
"rmapzen","rmapzen","Client for the 'Mapzen' API","0.3.3","MIT + file LICENSE","6.0.1",16,">= 2.10"
"wallace","wallace","A Modular Platform for Reproducible Modeling of Species Niches","0.6.1","GPL-3","5.0.1",17,">= 3.2.4"
"bazar","bazar","Miscellaneous Basic Functions","0.1.4","GPL-3","5.0.1",5,">= 3.1.3"
"googledrive","googledrive","An Interface to Google Drive","0.1.1","MIT + file LICENSE","6.0.1",16,">= 3.1.0"
"pdSpecEst","pdSpecEst","Positive-Definite Wavelet-Based Multivariate Spectral Analysis","1.0.0","GPL (>= 2)","5.0.1",7,">= 3.3.1"
"spmoran","spmoran","Moran's Eigenvector-Based Spatial Regression Models","0.1.0","GPL (>= 2)",NA,4,"*"
"CMatching","CMatching","Matching Algorithms for Causal Inference with Clustered Data","1.0","GPL-2",NA,6,">= 2.6.0"
"comtradr","comtradr","Interface with the United Nations Comtrade API","0.0.1","GPL-3","6.0.1",5,">= 3.0.0"
"PWFSLSmoke","PWFSLSmoke","Utilities for Working with Air Quality Monitoring Data","0.99.9","GPL-3","5.0.1",25,">= 3.1.0"
"uiucthemes","uiucthemes","'R' 'Markdown' Themes for 'UIUC' Documents and Presentations","0.1.1","MIT + file LICENSE","5.0.1",1,">= 3.0"
"auk","auk","eBird Data Extraction with AWK","0.0.1","GPL-3 | file LICENSE","6.0.1",11,">= 3.3.3"
"Delta","Delta","Measure of Agreement Between Two Raters","0.1.0.1","GPL-3","6.0.1.9000",1,">= 3.2.0"
"partitionComparison","partitionComparison","Implements Measures for the Comparison of Two Partitions","0.2.2","MIT + file LICENSE","6.0.1",4,">= 3.2.0"
"rjmcmc","rjmcmc","Reversible-Jump MCMC Using Post-Processing","0.2.2","GPL-3","6.0.1",5,">= 3.2.0"
"soundgen","soundgen","Parametric Voice Synthesis","1.0.0","GPL (>= 2)","6.0.1",16,">= 3.4"
"spatstat.data","spatstat.data","Datasets for 'spatstat'","1.0-1","GPL (>= 2)",NA,1,">= 3.3.0"
"TileManager","TileManager","Tile Manager","0.1.0","GPL (>= 3)","5.0.1",9,">= 3.3.2"
"ClassDiscovery","ClassDiscovery","Classes and Methods for ""Class Discovery"" with Microarrays or","3.3.7","Apache License (== 2.0)",NA,10,">= 3.0"
"dataMaid","dataMaid","A Suite of Checks for Identification of Potential Errors in a","0.9.2","GPL-2","5.0.1.9000",7,NA
"mdsOpt","mdsOpt","Searching for Optimal MDS Procedure for Metric Data","0.1-1","GPL (>= 2)",NA,3,NA
