"","pkg_name","title","pkg_ver","license","roxygen","n_depends","rversion"
"patternator","patternator","Feature Extraction from Female Brown Anole Lizard Dorsal","0.1.0","GPL (>= 2)","6.0.1",3,">= 3.3.0"
"SanFranBeachWater","SanFranBeachWater","Downloads and Tidies the San Francisco Public Utilities","0.1.0","MIT + file LICENSE","6.0.1",10,NA
"standardize","standardize","Tools for Standardizing Variables for Regression in R","0.1.0","GPL (>= 3)","5.0.1",11,">= 3.3.3"
"featurizer","featurizer","Some Helper Functions that Help Create Features from Data","0.1","GPL (>= 2)","6.0.1",2,">= 3.2.1"
"orderstats","orderstats","Efficiently Generates Random Order Statistic Variables","0.1.0","GPL-2","5.0.1",1,NA
"colorpatch","colorpatch","Optimized Rendering of Fold Changes and Confidence Values","0.1.2","Artistic-2.0","6.0.1",12,">= 3.0.0"
"soptdmaeA","soptdmaeA","Sequential Optimal Designs for Two-Colour cDNA Microarray","1.0.0","GPL-2",NA,4,">= 3.3.2"
"frequencies","frequencies","Create Frequency Tables with Counts and Rates","0.1.1","GPL-3","6.0.1",2,">= 3.4.0"
"getmstatistic","getmstatistic","Quantifying Systematic Heterogeneity in Meta-Analysis","0.1.0","MIT + file LICENSE","5.0.1.9000",9,">= 3.1.0"
"mixEMM","mixEMM","A Mixed-Effects Model for Analyzing Cluster-Level Non-Ignorable","1.0","GPL","6.0.1",0,NA
"Risk","Risk","Computes 26 Financial Risk Measures for Any Continuous","1.0","GPL (>= 2)",NA,0,">= 3.0.1"
"xsp","xsp","The Chi-Square Periodogram","0.1.2","MIT + file LICENSE","6.0.1",3,NA
"gqlr","gqlr","'GraphQL' Server in R","0.0.1","MIT + file LICENSE","6.0.1",9,">= 3.2.2"
"iNOTE","iNOTE","Integrative Network Omnibus Total Effect Test","1.0","GPL (>= 2)",NA,3,NA
"BAYESDEF","BAYESDEF","Bayesian Analysis of DSD","0.1.0","GPL (>= 2)","6.0.1",5,">= 3.0.0"
"bdlp","bdlp","Transparent and Reproducible Artificial Data Generation","0.9-1","GPL-2","6.0.1",14,">= 3.0.0"
"covfefe","covfefe","Covfefy Any Word, Sentence or Speech","0.1.0","GPL-3","6.0.1",2,NA
"gamlssbssn","gamlssbssn","Bimodal Skew Symmetric Normal Distribution","0.1.0","GPL-2","6.0.1",3,">= 3.3.0"
"gghalfnorm","gghalfnorm","Create a Half Normal Plot Using 'ggplot2'","1.1.1","MIT + file LICENSE","5.0.1",4,">= 3.1.0"
"HDCI","HDCI","High Dimensional Confidence Interval Based on Lasso and","1.0-2","GNU General Public License version 2","6.0.1",9,NA
"iadf","iadf","Analysis of Intra Annual Density Fluctuations","0.1.0","GPL-3","6.0.1",11,NA
"piton","piton","Parsing Expression Grammars in Rcpp","0.1.0","MIT + file LICENSE","6.0.1",3,NA
"pwrAB","pwrAB","Power Analysis for AB Testing","0.1.0","GPL (>= 3)","6.0.1",2,">= 3.3.1"
"rpst","rpst","Recursive Partitioning Survival Trees","1.0.0","GPL-3",NA,2,">= 2.0.0"
"themetagenomics","themetagenomics","Exploring Thematic Structure and Predicted Functionality of 16s","0.1.0","MIT + file LICENSE","6.0.1.9000",27,">= 3.2.5"
"zstdr","zstdr","R Bindings to Zstandard Compression Library","0.1.0","GPL (>= 2)","6.0.1",3,NA
"capn","capn","Capital Asset Pricing for Nature","1.0.0","GPL (>= 2)",NA,0,">= 3.0.1"
"imaginator","imaginator","Simulate General Insurance Policies and Losses","0.1.1","GPL-3","6.0.1",9,">= 3.2.3"
"ck37r","ck37r","Chris Kennedy's R Toolkit","1.0.0","MIT + file LICENSE","6.0.1",23,">= 3.1.0"
"eesim","eesim","Simulate and Evaluate Time Series for Environmental Epidemiology","0.1.0","GPL (>= 2)","6.0.1",11,NA
"glmertree","glmertree","Generalized Linear Mixed Model Trees","0.1-1","GPL-2 | GPL-3",NA,8,">= 3.1.0"
"KRMM","KRMM","Kernel Ridge Mixed Model","1.0","GPL-2 | GPL-3","5.0.1",5,">= 3.3.0"
"NB.MClust","NB.MClust","Negative Binomial Model-Based Clustering","1.0.0","GPL (>= 2)","6.0.1",2,">= 3.3.3"
"hypersampleplan","hypersampleplan","Attribute Sampling Plan with Exact Hypergeometric Probabilities","0.1.1","GPL-2",NA,0,NA
"logOfGamma","logOfGamma","Natural Logarithms of the Gamma Function for Large Values","0.0.1","GPL-3","5.0.1",1,NA
"webglobe","webglobe","3D Interactive Globes","1.0.2","MIT + file LICENCE","6.0.1",6,">= 3.4.0"
"kerasR","kerasR","R Interface to the Keras Deep Learning Library","0.4.1","LGPL-2","6.0.1",3,">= 3.3.0"
"QPBoot","QPBoot","Model Validation using Quantile Spectral Analysis and Parametric","0.2","GPL (>= 2)","6.0.1",6,">= 3.0.0"
"baitmet","baitmet","Library Driven Compound Profiling in GC-MS Data","1.0.0","GPL (>= 2)",NA,8,"*"
"difconet","difconet","Differential Coexpressed Networks","1.0-4","GPL (>= 2)",NA,8,">= 3.1.0"
"ElastH","ElastH","Replicar metodologia de SPE/MF para calculo de elasticidade de","0.3","GPL","5.0.1",2,">= 2.10"
"ids","ids","Generate Random Identifiers","1.0.0","MIT + file LICENSE","5.0.1",6,NA
"ImaginR","ImaginR","Delimit and Characterize Color Phenotype of the Pearl Oyster","0.1.7","GPL (>= 2)","6.0.1",3,NA
"logistic4p","logistic4p","Logistic Regression with Misclassification in Dependent","1.5","GPL","5.0.1",1,">= 2.10"
"pencopulaCond","pencopulaCond","Estimating Non-Simplified Vine Copulas Using Penalized Splines","0.2","GPL (>= 2)",NA,10,">= 3.1.1"
"mdpeer","mdpeer","Graph-Constrained Regression with Enhanced Regularization","0.1.0","GPL-2","5.0.1",11,">= 3.3.1"
"DDM","DDM","Death Registration Coverage Estimation","1.0-0","GPL-2","6.0.1",0,">= 2.15"
"dfCompare","dfCompare","Compare Two Dataframes and Return Adds, Changes, and Deletes","1.0.0","GPL-3",NA,0,NA
"phrasemachine","phrasemachine","Simple Phrase Extraction","1.0.0","GPL-3","5.0.1",7,NA
"here","here","A Simpler Way to Find Your Files","0.1","GPL-3","6.0.1",1,NA
"SmartSVA","SmartSVA","Implementation of Smart SVA","0.1.0","GPL-3","5.0.1",2,NA
"didrooRFM","didrooRFM","Compute Recency Frequency Monetary Scores for your Customer Data","1.0.0","GPL-2","6.0.1",1,">= 3.3.3"
"polypoly","polypoly","Helper Functions for Orthogonal Polynomials","0.0.2","GPL-3","6.0.1",10,">= 3.3.3"
"SeerMapper","SeerMapper","A Quick Way to Map U.S. Rates and Data of U. S. States,","1.2.0","GPL (>= 2)",NA,13,">= 3.2.0"
"stratvns","stratvns","Optimal Stratification in Stratified Sampling Optimization","1.0","GPL-2","6.0.1",5,NA
"CharFun","CharFun","Numerical Computation Cumulative Distribution Function and","0.1.0","MIT + file LICENSE","5.0.1",1,NA
"stratbr","stratbr","Optimal Stratification in Stratified Sampling","1.0","GPL-2","5.0.1",3,NA
"tictactoe","tictactoe","Tic-Tac-Toe Game","0.2.0","MIT + file LICENSE","5.0.1",8,">= 2.10"
"apng","apng","Convert Png Files into Animated Png","1.0","GPL-3 | file LICENSE",NA,1,NA
"rdoxygen","rdoxygen","Create Doxygen Documentation for Source Code","1.0.0","GPL-2 | file LICENSE","6.0.1",2,">= 3.3.3"
"timelineR","timelineR","Visualization for Time Series Data","0.1.0","AGPL-3","6.0.1",11,">= 3.3.0"
"TriadSim","TriadSim","Simulating Triad Genomewide Genotypes","0.0.1","GPL-3","5.0.1",7,">= 3.2.2"
"lans2r","lans2r","Work with Look at NanoSIMS Data in R","1.0.5","GPL-3 | file LICENSE","6.0.1",10,">= 3.1"
"wally","wally","The Wally Calibration Plot for Risk Prediction Models","1.0.8","GPL (>= 2)","5.0.1",6,">= 2.9.0"
"RHPCBenchmark","RHPCBenchmark","Benchmarks for High-Performance Computing Environments","0.1.0","Apache License 2.0 | file LICENSE","6.0.1",7,">= 3.3.1"
"RNAstructureModuleMiner","RNAstructureModuleMiner","RNA Secondary Structure Comparison and Module Mining","0.1.0","GPL-2",NA,1,NA
"ROI.models.miplib","ROI.models.miplib","'MIPLIB' 2010 Benchmark Instances","0.0-1","GPL-3","6.0.1",3,">= 2.10"
"rpatrec","rpatrec","Recognising Visual Charting Patterns in Time Series Data","0.9.1","GPL-3","6.0.1.9000",6,">= 2.10"
"xLLiM","xLLiM","High Dimensional Locally-Linear Mapping","1.0","GPL (>= 2)",NA,4,NA
"Rd2md","Rd2md","Markdown Reference Manuals","0.0.1","GPL","5.0.1",5,">= 3.2.3"
"sotu","sotu","United States Presidential State of the Union Addresses","1.0.2","GPL-2","6.0.1",1,">= 2.10"
"NPMOD","NPMOD","Non Parametric Module","0.1.0","GPL (>= 2)","6.0.1",9,">= 3.0.0"
"AHMbook","AHMbook","Functions and Data for the Book 'Applied Hierarchical Modeling","0.1.3","GPL (>= 3)",NA,11,">= 2.10"
"CATT","CATT","The Cochran-Armitage Trend Test","1.0","GPL-3",NA,1,">= 3.3.2"
"checkarg","checkarg","Check the Basic Validity of a (Function) Argument","0.1.0","GPL (>= 2)","6.0.1",0,">= 3.1.0"
"kdevine","kdevine","Multivariate Kernel Density Estimation with Vine Copulas","0.3.0","GPL-3 | file LICENSE","5.0.1",12,NA
"numKM","numKM","Create a Kaplan-Meier Plot with Numbers at Risk","0.1.0","GPL-3",NA,3,NA
"poisbinom","poisbinom","A Faster Implementation of the Poisson-Binomial Distribution","1.0.0","GPL (>= 2)",NA,2,NA
"printr","printr","Automatically Print R Objects to Appropriate Formats According","0.1","GPL","6.0.1",3,NA
"GUIgems","GUIgems","Graphical User Interface for Generalized Multistate Simulation","0.1","GPL-3","6.0.1.9000",12,NA
"easyNCDF","easyNCDF","Tools to Easily Read/Write NetCDF Files into/from","0.0.1","LGPL-3",NA,2,">= 2.14.1"
"zeligverse","zeligverse","Easily Install and Load Stable Zelig Packages","0.1.0","GPL (>= 3)","6.0.1",8,NA
"ExcessMass","ExcessMass","Excess Mass Calculation and Plots","1.0","LGPL",NA,1,NA
"PROscorer","PROscorer","Functions to Score Commonly-Used Patient-Reported Outcome (PRO)","0.0.1","MIT + file LICENSE","6.0.1",5,NA
"rif","rif","Client for 'Neuroscience' Information Framework 'APIs'","0.1.0","MIT + file LICENSE","6.0.1",9,NA
"PairwiseD","PairwiseD","Pairing Up Units and Vectors in Panel Data Setting","0.9.58","GPL-2","6.0.1",3,NA
"PROscorerTools","PROscorerTools","Tools to Score Patient-Reported Outcome (PRO) and Other","0.0.1","MIT + file LICENSE","6.0.1",4,NA
"slim","slim","Singular Linear Models for Longitudinal Data","0.1.0","GPL-3","5.0.1",10,">= 3.2.0"
"gomms","gomms","GLM-Based Ordination Method","1.0","GPL (>= 2)",NA,0,NA
"GEEmediate","GEEmediate","Mediation Analysis for Generalized Linear Models Using the","1.0.0","GPL (>= 3)","5.0.1",1,">= 3.3.0"
"learnrbook","learnrbook","Datasets for Aphalo's ""Learn R"" Book","0.0.2","GPL (>= 2)","6.0.1",4,">= 3.3.0"
"mbgraphic","mbgraphic","Measure Based Graphic Selection","1.0.0","GPL (>= 2)","6.0.1",22,">= 3.1"
"diffMeshGP","diffMeshGP","Multi-Fidelity Computer Experiments Using the Tuo-Wu-Yu Model","0.1.0","GPL (>= 2)","6.0.1",1,NA
"EpistemicGameTheory","EpistemicGameTheory","Constructing an Epistemic Model for the Games with Two Players","0.1.0","GPL-3","6.0.1",4,NA
"fastTextR","fastTextR","An Interface to the 'fastText' Library","1.0","BSD_3_clause + file LICENSE","5.0.1",4,NA
"iGSEA","iGSEA","Integrative Gene Set Enrichment Analysis Approaches","1.2","GPL-2",NA,0,NA
"jocre","jocre","Joint Confidence Regions","0.1","GPL-2",NA,3,NA
"lifelogr","lifelogr","Life Logging","0.1.0","GPL (>= 2)","6.0.1",17,">= 3.0.2"
"shinycssloaders","shinycssloaders","Add CSS Loading Animations to 'shiny' Outputs","0.1.0","GPL-3","5.0.1",4,NA
"sinib","sinib","Sum of Independent Non-Identical Binomial Random Variables","1.0.0","GPL-3","6.0.1",0,NA
"usedist","usedist","Distance Matrix Utilities","0.1.0","GPL-3","6.0.1",1,NA
"iECAT","iECAT","Integrating External Controls into Association Test","0.8","GPL (>= 2)",NA,2,">= 2.13.0"
"lhmixr","lhmixr","Fit Sex-Specific Life History Models with Missing","0.1.0","GPL (>= 3)","6.0.1",0,">= 3.2.0"
"pawls","pawls","Penalized Adaptive Weighted Least Squares Regression","1.0.0","GPL-2","6.0.1",1,NA
"WebGestaltR","WebGestaltR","The R Version of WebGestalt","0.0.5","LGPL",NA,8,">= 3.3"
"lindia","lindia","Automated Linear Regression Diagnostic","0.9","MIT + file LICENSE","6.0.1",3,">= 3.2.2"
"lsasim","lsasim","Simulate Large Scale Assessment Data","1.0.0","GPL-3","5.0.1",0,">= 3.3.1"
"outbreaks","outbreaks","A Collection of Disease Outbreak Data","1.0.0","GPL (>= 2)","5.0.1",2,">= 3.0.0"
"qrsvm","qrsvm","SVM Quantile Regression with the Pinball Loss","0.2.1","GPL-2","6.0.1",6,NA
"AcuityView","AcuityView","A Package for Displaying Visual Scenes as They May Appear to an","0.1","GPL (>= 2)","6.0.1.9000",7,">= 3.0.0"
"plotprotein","plotprotein","Development of Visualization Tools for Protein Sequence","1.0","GPL-3",NA,5,NA
"IndianTaxCalc","IndianTaxCalc","Indian Income Tax Calculator","1.0.1","GPL (>= 2)",NA,0,NA
"RPEXE.RPEXT","RPEXE.RPEXT","Reduced Piecewise Exponential Estimate/Test Software","0.0.1","GPL-3","6.0.1.9000",4,">= 3.2.2"
"PROreg","PROreg","Patient Reported Outcomes Regression Analysis","1.0","GPL",NA,7,NA
"pwr2","pwr2","Power and Sample Size Analysis for One-way and Two-way ANOVA","1.0","GPL-2",NA,0,NA
"cowbell","cowbell","Performs Segmented Linear Regression on Two Independent","0.1.0","GPL-3","6.0.1",7,">= 3.3.0"
"crunchy","crunchy","Shiny Apps on Crunch","0.2.0","LGPL (>= 3)","6.0.0",4,">= 3.0.0"
"ContourFunctions","ContourFunctions","Create Contour Plots from Data or a Function","0.1.0","GPL-3","6.0.1",4,NA
"DataGraph","DataGraph","Export Data from R so DataGraph can Read it","1.0","GPL (>= 2)",NA,2,NA
"idar","idar","Individual Diversity-Area Relationships","1.0","GPL (>= 2)",NA,6,NA
"seasonalview","seasonalview","Graphical User Interface for Seasonal Adjustment","0.1.3","GPL-3","5.0.1",8,NA
"kmcudaR","kmcudaR","'Yinyang' K-Means and K-NN using NVIDIA CUDA","1.0.0","MIT + file LICENSE","5.0.1.9000",4,">= 3.3.2"
"m2b","m2b","Movement to Behaviour Inference using Random Forest","1.0","GPL-3","6.0.1",15,">= 3.3.0"
"qrmix","qrmix","Quantile Regression Mixture Models","0.9.0","LGPL","6.0.1",2,NA
"discord","discord","Functions for Discordant Kinship Modeling","0.1","GPL-3","6.0.1.9000",2,NA
"dsrTest","dsrTest","Tests and Confidence Intervals on Directly Standardized Rates","0.1","GPL (>= 2)","6.0.1",4,NA
"KSEAapp","KSEAapp","Kinase-Substrate Enrichment Analysis","0.99.0","MIT + file LICENSE","6.0.1",7,">= 2.10"
"mut","mut","Pairwise Likelihood Ratios","1.1","GPL (>= 2)",NA,4,">= 3.2.0"
"ncdump","ncdump","Extract Metadata from 'NetCDF' Files as Data Frames","0.0.3","GPL-3","6.0.1",6,NA
"onehot","onehot","Fast Onehot Encoding for Data.frames","0.1.1","MIT + file LICENSE","6.0.1",0,NA
"angstroms","angstroms","Tools for 'ROMS' the Regional Ocean Modeling System","0.0.1","GPL-3","6.0.1",8,">= 3.3.0"
"EML","EML","Read and Write Ecological Metadata Language Files","1.0.1","FreeBSD","5.0.1",7,NA
"MHTmult","MHTmult","Multiple Hypotheses Testing for Multiple Families/Groups","0.1.0","GPL (>= 2)",NA,3,NA
"MetaboList","MetaboList","Annotation of Metabolites from Liquid Chromatography-Mass","1.0","GPL-2",NA,1,">= 3.2.3"
"pafdR","pafdR","Book Companion for Processing and Analyzing Financial Data with","1.0","GPL-2","6.0.1",9,">= 3.3.3"
"SPADAR","SPADAR","Spherical Projections of Astronomical Data","1.0","GPL (>= 3)",NA,2,NA
"ChocoLattes","ChocoLattes","Processing Data from Lattes CV Files","0.1.0","GPL-2","6.0.1",10,">= 3.3.1"
"dataseries","dataseries","Switzerland's Data Series in One Place","0.1.0","GPL-3","6.0.0",1,NA
"mockr","mockr","Mocking in R","0.1","GPL-3","6.0.1",3,NA
"casebase","casebase","Fitting Flexible Smooth-in-Time Hazards and Risk Functions via","0.1.0","MIT + file LICENSE","6.0.1",10,">= 3.3.1"
"gsrsb","gsrsb","Group Sequential Refined Secondary Boundary","1.0.3","GPL-3","6.0.1",4,NA
"WikidataQueryServiceR","WikidataQueryServiceR","API Client Library for 'Wikidata Query Service'","0.1.0","MIT + file LICENSE","5.0.1",5,">= 3.1.2"
"aSPC","aSPC","An Adaptive Sum of Powered Correlation Test (aSPC) for Global","0.1.2","GPL-3","5.0.1",3,NA
"mstherm","mstherm","Analyze MS/MS Protein Melting Data","0.4.7","GPL-3","6.0.1",10,NA
"bulletr","bulletr","Algorithms for Matching Bullet Lands","0.1","GPL-3","6.0.1",9,">= 3.1"
"coxphMIC","coxphMIC","Sparse Estimation of Cox Proportional Hazards Models via","0.1.0","GPL-2","6.0.1",5,">= 3.1.0"
"md.log","md.log","Produces Markdown Log File with a Built-in Function Call","0.1.1","MIT + file LICENSE","6.0.1",1,NA
"censCov","censCov","Linear Regression with a Randomly Censored Covariate","1.0-0","GPL (>= 3)",NA,1,NA
"RandMeta","RandMeta","Efficient Numerical Algorithm for Exact Inference in Meta","0.1.0","GPL-2","6.0.1",0,">= 2.10"
"zip","zip","Cross-Platform 'zip' Compression","1.0.0","CC0","6.0.1",3,NA
"ajv","ajv","Another JSON Schema Validator","1.0.0","GPL-2","5.0.1",6,NA
"BarBorGradient","BarBorGradient","Function Minimum Approximator","1.0.5","GPL-3","6.0.1",1,">= 3.0.0"
"ider","ider","Various Methods for Estimating Intrinsic Dimension","0.1.0","GPL-2","6.0.1",2,">= 3.2.1"
"nonpar","nonpar","A Collection of Nonparametric Hypothesis Tests","1.0.0","GPL-3",NA,1,">= 3.3.1"
"ring","ring","Circular / Ring Buffers","1.0.0","MIT + file LICENSE","5.0.1",4,NA
"selectapref","selectapref","Analysis of Field and Laboratory Foraging","0.1.0","GPL (>= 2)","6.0.1",0,">= 3.2.3"
"startR","startR","Automatically Retrieve Multidimensional Distributed Data Sets","0.0.1","LGPL-3",NA,6,">= 2.14.1"
"chemmodlab","chemmodlab","A Cheminformatics Modeling Laboratory for Fitting and Assessing","1.0.0","GPL-3","5.0.1",21,">= 3.1.1"
"CrossScreening","CrossScreening","Cross-Screening in Observational Studies that Test Many","0.0.1","GPL-2","5.0.1",5,NA
"KENDL","KENDL","Kernel-Smoothed Nonparametric Methods for Environmental Exposure","1.0","GPL-2",NA,0,NA
"RpeakChrom","RpeakChrom","Tools for Chromatographic Column Characterization and Modelling","0.1.0","GPL-2",NA,4,">= 2.10.1"
"SADISA","SADISA","Species Abundance Distributions with Independent-Species","1.0","GPL-3","5.0.1",6,NA
"simMP","simMP","Simulate Somatic Mutations in Cancer Genomes from Mutational","0.17.3","GPL-2",NA,12,">= 3.0.0"
"statGraph","statGraph","Statistical Methods for Graphs","0.1.0","GPL (>= 3)","5.0.1",4,">= 2.10.0"
"unix","unix","Unix System Utilities","1.0","MIT + file LICENSE","6.0.1",0,NA
"PortfolioOptim","PortfolioOptim","Small/Large Sample Portfolio Optimization","1.0.3","GNU General Public License version 3","6.0.1",3,">= 3.3.0"
"PCADSC","PCADSC","Tools for Principal Component Analysis-Based Data Structure","0.8.0","GPL-2","5.0.1",5,">= 3.2.2"
"yarrr","yarrr","The Pirate's Guide to R","0.0.9","GPL-2","5.0.1",4,NA
"icosa","icosa","Global Triangular and Penta-Hexagonal Grids Based on Tessellated","0.9.80","GPL-3","5.0.1",10,">= 3.2.2"
"TSGSIS","TSGSIS","Two Stage-Grouped Sure Independence Screening","0.1","GPL (>= 2)","6.0.1",3,">= 3.2.3"
"uqr","uqr","Unconditional Quantile Regression","0.1.0","GPL (>= 2)","5.0.1",5,">= 3.3.1"
"WLreg","WLreg","Regression Analysis Based on Win Loss Endpoints","1.0.0","GPL (>= 2)","5.0.1",3,">= 3.1.2"
"mro","mro","Multiple Correlation","0.1.1","GPL-2","6.0.1",2,">= 3.1.0"
"complexity","complexity","Calculate the Proportion of Permutations in Line with an","1.0.0","GPL (>= 2)",NA,1,NA
"bayesCL","bayesCL","Bayesian Inference on a GPU using OpenCL","0.0.1","GPL (>= 3)","6.0.1",0,">= 2.14.0"
"SeerMapper2010East","SeerMapper2010East","Supplemental U. S. 2010 Census Tract Boundaries for 23 Eastern","1.2.0","GPL (>= 2)",NA,1,">= 3.2.0"
"SeerMapper2010West","SeerMapper2010West","Supplemental U.S. 2010 Census Tract Boundaries for 14 Western","1.2.0","GPL (>= 2)",NA,1,">= 3.2.0"
"StatPerMeCo","StatPerMeCo","Statistical Performance Measures to Evaluate Covariance Matrix","0.1.0","GPL (>= 2)",NA,0,NA
"thankr","thankr","Find Out Who Maintains the Packages you Use","1.0.0","MIT + file LICENSE","6.0.1",4,NA
"fpest","fpest","Estimating Finite Population Total","0.1.1","GPL-3","6.0.1",0,NA
"nopaco","nopaco","A Non-Parametric","0.99.4","GPL (>= 3)","5.0.1",5,NA
"R2ucare","R2ucare","Goodness-of-Fit Tests for Capture-Recapture Models","1.0.0","GPL (>= 2)","5.0.1.9000",6,">= 3.3.0"
"SeerMapper2010Regs","SeerMapper2010Regs","Supplemental U. S. 2010 Census Tract Boundaries for 15 States","1.2.0","GPL (>= 2)",NA,1,">= 3.2.0"
"spec","spec","A Data Specification Format and Interface","0.1.1","GPL-3","6.0.1",4,">= 2.10"
"Tnseq","Tnseq","Identification of Conditionally Essential Genes in Transposon","0.1.1","GPL (>= 3)",NA,6,NA
"tubern","tubern","R Client for the YouTube Analytics and Reporting API","0.1.0","MIT + file LICENSE","6.0.1",6,">= 3.2.0"
"wrangle","wrangle","A Systematic Data Wrangling Idiom","0.3","GPL-3","6.0.1",4,NA
"marcher","marcher","Migration and Range Change Estimation in R","0.0-2","GPL-2","6.0.1",15,">= 3.3.0"
"optrcdmaeAT","optrcdmaeAT","Optimal Row-Column Designs for Two-Colour cDNA Microarray","1.0.0","GPL-2",NA,4,">= 3.3.2"
"SeerMapperEast","SeerMapperEast","Supplemental U. S. 2000 Census Tract Boundaries for 23 Eastern","1.2.0","GPL (>= 2)",NA,1,">= 3.2.0"
"SeerMapperWest","SeerMapperWest","Supplemental U.S. 2000 Census Tract Boundaries for 14 Western","1.2.0","GPL (>= 2)",NA,1,">= 3.2.0"
"fastqcr","fastqcr","Quality Control of Sequencing Data","0.1.0","GPL-2","6.0.1",15,">= 3.1.2"
"GADAG","GADAG","A Genetic Algorithm for Learning Directed Acyclic Graphs","0.99.0","GPL-2","6.0.1",5,NA
"GLIDE","GLIDE","Global and Individual Tests for Direct Effects","1.0.1","GPL (>= 2)",NA,4,">= 2.10"
"D3GB","D3GB","Interactive Genome Browser with R","1.1","CC BY-NC-SA 4.0",NA,6,">= 3.0.0"
"lspline","lspline","Linear Splines with Convenient Parametrisations","1.0-0","MIT + file LICENSE","6.0.1",6,NA
"SeerMapperRegs","SeerMapperRegs","Supplemental U. S. 2000 Census Tract Boundary for 15 States with","1.2.0","GPL (>= 2)",NA,1,">= 3.2.0"
"mRchmadness","mRchmadness","Numerical Tools for Filling Out an NCAA Basketball Tournament","1.0.0","GPL-2","6.0.1",8,">= 3.3.0"
"skeletor","skeletor","An R Package Skeleton Generator","1.0.0","MIT + file LICENSE","5.0.1",1,">= 3.0.0"
"duckduckr","duckduckr","Simple Client for the DuckDuckGo Instant Answer API","1.0.0","MIT + file LICENSE","6.0.1",4,NA
"IMTest","IMTest","Information Matrix Test for Generalized Partial Credit Models","1.0.0","GPL (>= 2)","6.0.1",6,">= 3.3.0"
"MedDietCalc","MedDietCalc","Multi Calculator to Compute Scores of Adherence to Mediterranean","0.1.0","GPL-3","5.0.1",4,NA
"micEconIndex","micEconIndex","Price and Quantity Indices","0.1-6","GPL (>= 2)",NA,3,">= 2.4.0"
"secure","secure","Sequential Co-Sparse Factor Regression","0.1","GPL (>= 3.0)","5.0.1",4,">= 3.3.1"
"sylcount","sylcount","Syllable Counting and Readability Measurements","0.1-0","BSD 2-clause License + file LICENSE","6.0.1",0,">= 3.0.0"
"classifierplots","classifierplots","Generates a Visualization of Classifier Performance as a Grid of","1.3.1","BSD 3-clause License + file LICENSE","5.0.1",10,">= 3.1"
"CoFRA","CoFRA","Complete Functional Regulation Analysis","0.1001","GPL-2 | file LICENSE","5.0.1",7,">= 3.2.3"
"eshrink","eshrink","Shrinkage for Effect Estimation","0.1.0","GPL (>= 2)","5.0.1",2,">= 3.2.0"
"zfa","zfa","Zoom-Focus Algorithm","1.0","GPL","5.0.1",1,">= 3.1.0"
"HYRISK","HYRISK","Hybrid Methods for Addressing Uncertainty in RISK Assessments","1.2","GPL-3",NA,11,">= 3.2.0"
"TSMN","TSMN","Truncated Scale Mixtures of Normal Distributions","1.0.0","GPL (>= 3.0)",NA,0,NA
"afmToolkit","afmToolkit","Functions for Atomic Force Microscope Force-Distance Curves","0.0.1","GPL","5.0.1",11,">= 3.2.2"
"groupsubsetselection","groupsubsetselection","Group Subset Selection","1.0.3","GPL-2",NA,0,NA
"nlshelper","nlshelper","Convenient Functions for Non-Linear Regression","0.2","GPL-2","5.0.1",5,NA
"vesselr","vesselr","Gradient and Vesselness Tools for Arrays and NIfTI Images","0.1.0","GPL-2","6.0.1",4,NA
"xbreed","xbreed","Genomic Simulation of Purebred and Crossbred Populations","1.0.0","GPL-3","6.0.1",5,">= 3.3.2"
"xyz","xyz","The 'xyz' Algorithm for Fast Interaction Search in","0.1","GPL","5.0.1",5,NA
"enrichR","enrichR","Provides an R Interface to 'Enrichr'","1.0","GPL (>= 2)","6.0.1",4,">= 3.0.0"
"medicare","medicare","Tools for Obtaining and Cleaning Medicare Public Use Files","0.1.0","MIT + file LICENSE","5.0.1",7,">= 2.10"
"grapes","grapes","Make Binary Operators","1.0.0","GPL (>= 3)","5.0.1",4,">= 3.0.0"
"InterfaceqPCR","InterfaceqPCR","GUI to Analyse qPCR Results after PMA Treatment or not","1.0","GPL-2","5.0.1",10,">= 3.1.0"
"SARP.moodle","SARP.moodle","XML Output Functions for Easy Creation of Moodle Questions","0.3.6","Artistic-2.0",NA,2,NA
"tensorr","tensorr","Sparse Tensors in R","0.1.0","GPL-3","6.0.1",10,">= 3.3.3"
"aptg","aptg","Automatic Phylogenetic Tree Generator","0.1.0","MIT + file LICENSE","6.0.1",9,NA
"focusedMDS","focusedMDS","Focused, Interactive Multidimensional Scaling","1.2.4","GNU General Public License","5.0.1",2,">= 3.3.1"
"kscons","kscons","A Bayesian Approach for Protein Residue Contact Prediction using","0.7.0","GPL (>= 2)",NA,0,">= 2.10"
"optim.functions","optim.functions","Standard Benchmark Optimization Functions","0.1","MIT + file LICENSE","5.0.1",6,">= 3.0"
"BLModel","BLModel","Black-Litterman Posterior Distribution","1.0.2","GNU General Public License version 3","6.0.1",2,">= 3.3.0"
"fam2r","fam2r","From 'Familias' to R","1.2","GPL (>= 2)",NA,2,">= 3.2.0"
"metavcov","metavcov","Variance-Covariance Matrix for Multivariate Meta-Analysis","0.1","GPL (>= 2)",NA,1,NA
"moezipfR","moezipfR","Marshall-Olkin Extended Zipf","1.0","GPL-3","5.0.1",5,">= 2.0.1"
"patternize","patternize","Quantification of Color Pattern Variation","0.0.1","GPL-3","6.0.1",6,">= 3.2.2"
"tilegramsR","tilegramsR","R Spatial Data for Tilegrams","0.1.4","MIT + file LICENSE","5.0.1",9,">= 3.1.0"
"tsqn","tsqn","Applications of the Qn Estimator to Time Series (Univariate and","1.0.0","GPL (>= 2)","6.0.1",3,">= 3.2.3"
"itan","itan","Item Analysis for Multiple Choice Tests","1.0","GPL (>= 2)","6.0.1",2,NA
"shinyHeatmaply","shinyHeatmaply","Deploy 'heatmaply' using 'shiny'","0.1.0","GPL-2 | GPL-3","6.0.1",13,">= 2.3.0"
"NetworkRiskMeasures","NetworkRiskMeasures","Risk Measures for (Financial) Networks","0.1.1","GPL-3","5.0.1",6,NA
"slimrec","slimrec","Sparse Linear Method to Predict Ratings and Top-N","0.1.0","GPL-3","5.0.1",7,">= 3.3.3"
"TeachBayes","TeachBayes","Teaching Bayesian Inference","0.1.0","GPL (>= 2)",NA,7,NA
"vortexRdata","vortexRdata","Example Data for R Package 'vortexR'","1.0.3","GPL-3","6.0.1",0,">= 3.1.0"
"docstring","docstring","Provides Docstring Capabilities to R Functions","1.0.0","GPL-2","6.0.1",7,NA
"IPWsurvival","IPWsurvival","Propensity Score Based Adjusted Survival Curves and","0.5","GPL (>= 2)",NA,2,">= 2.10"
